created,title,body
2011-12-14,"ETFs to Watch December 14, 2011","Here is the ETF Professor's ETF Watch List for Wednesday December 14, 2011. The Market Vectors Junior Gold Miners ETF (NYSE: GDXJ) is in technical trouble as is the iShares Silver Trust (NYSE: SLV). Earnings play: Market Vectors Coal ETF (NYSE: KOL). The iShares Dow Jones US Oil Equipment Index Fund (NYSE: IEZ) will be in trouble on a drop below $50. Emerging markets plays of the day: ProShares UltraShort Brazil (NYSE: BZQ), Direxion Daily Russia Bear 3X Shares (NYSE: RUSS) and the Direxion Daily Latin America Bear 3X Shares (NYSE: LHB). Forex play of the day: PowerShares DB Dollar Bullish (NYSE: UUP). Bond play of the day: iShares Barclays 20+ Year Treasury Bond ETF (NYSE: TLT)."
2011-12-14,Safe Haven No More: ETFs For Gold's Decline,"Paradise has been lost. At least for the gold bugs. We're not saying the decade-long bull run in gold is over, but there are ominous signs to that affect. Take the case of the SPDR Gold Shares (NYSE: GLD) for example. The world's second-largest ETF by assets is below its 200-day moving average on its weekly chart for the first time since early 2009. The point and figure chart for the ETF indicates a decline to $136 is possible and, not surprisingly, the outlook is no better for GLD rivals such as the iShares Comex Gold Trust (NYSE: IAU). Maybe the yellow metal is taking a rest. Maybe it's about to reverse trend and enter a legitimate bear market. Time will tell and we'll tell you about some of the ETFs you need to know about for an extended gold slide. Potential Winners Direxion Daily Gold Miners 3X Bear Shares (NYSE: DUST): Apparently, we were ahead of the game by touting this ETF back in September. Back then, DUST was double leveraged, but it recently added some juice and moved to the triple leveraged neighborhood. Put it this way, if gold mining stocks and ETFs struggled to rise with gold going higher, they're not going to go up with gold going down. DUST has a lot of upside in it, perhaps even 10% over the next few days. PowerShares Dollar Bullish (NYSE: UUP): We're having a hard time believing it, too. Two endorsements for UUP in the same day. Well, if gold isn't a safe have right now, then what is? Obviously the U.S. dollar. ProShares UltraShort Silver (NYSE: ZSL): The experts say gold drags silver higher. Logically, that means it would drag the white metal lower. The bad news is the iShares Silver Trust (NYSE: SLV) and the ETFS Physical Silver Shares (NYSE: SIVR) need no downside assistance as both are down more than 23% in the past three months. That means it's time to dial up ZSL, which can ring up gains of 5% or more in a single day. WisdomTree Managed Futures ETF (NYSE: WDTI): As we've been telling you lately, the WisdomTree Managed Futures ETF has short positions in gold and silver futures. Obviously, that makes this unheralded ETF worth a look here. Potential Losers Market Vectors Junior Gold Miners ETF (NYSE: GDXJ): Reference the part on DUST for information, but consider this as well: If GDXJ violates support at $24, its probably going to $20 for the first time since early 2010. By the way, this probably isn't the environment for small-caps of any stripe. CurrencyShares Australian Dollar Trust (NYSE: FXA): The Aussie dollar is a commodity currency and the commodity it has shown a historical correlation with is gold. Typically, gold moves first and the Aussie dollar responds. That could mean more declines for FXA are on the way, especially if support at $98 is violted. iShares MSCI South Africa Index Fund (NYSE: EZA): EZA did not make our list of emerging markets ETFs to watch next year. Now we might have a really good reason for that. South Africa is a major gold miner and EZA has been acting like a mining ETF, slumping as gold has gone up. In fact, EZA is down almost 21% year-to-date even as the SPDR Gold Shares is up more than 15%. That's not a good sign. Action Items: Traders that believe gold is going to continue falling should consider the following trades: Long DUST, long the PowerShares DB Gold Double Short ETN (NYSE: DZZ), long UUP. Traders that are willing to bet on a rebound for gold should consider the following trades: Long IAU, Short ZSL, long the ETFS Physical PM Basket Shares (NYSE: GLTR). Neither Benzinga nor its staff recommend that you buy, sell, or hold any security. We do not offer investment advice, personalized or otherwise. Benzinga recommends that you conduct your own due diligence and consult a certified financial professional for personalized advice about your financial situation."
2012-01-05,5 Commodities ETFs That Could Disappoint In 2012,"Rising oil prices. Debased currencies. Central banks eager to print more money. If the past couple of years have taught investors anything it is that having some commodities exposure within a portfolio isn't such a bad thing. The other side of that coin is that selectivity is a must when picking commodities ETFs and ETNs. Simply put, not all commodities are sure bets from the long side. In fact, some commodities ETFs and ETNs are epic disappointments for any number of reasons. Whether it's the continuous rolling of futures contracts or just downright slack price action in the underlying commodity itself, some commodities exchange-traded products look poised to be better short trades than anything else in 2012. Here are five to consider avoiding. iPath DJ-UBS Livestock TR Sub-Index ETN (NYSE: COW) Holy cow, did you know that feeder cattle futures provided the best returns of all commodities when adjusted for volatility in the second half of last year? That factoid comes courtesy of Bloomberg, which notes feeder cattle even outperformed gold in the back half of 2011. COW tracks lean hogs and live cattle prices, so it's not a play on a feeder cattle. What COW is is a disappointment. The ETN underperformed the SPDR Gold Shares (NYSE: GLD) in the past six months and if the global economy slows, live cattle prices will fall, pressuring COW along the way. iPath DJ-UBS Coffee TR Sub-Index ETN (NYSE: JO) Brazil, the world's largest coffee producer, is expected to turnout robust coffee supplies this year and unless the weather there suddenly changes for the worse, it's clear the iPath DJ-UBS Coffee TR Sub-Index ETN could be caught on the wrong side of the supply/demand dynamic. The reality is global coffee demand is soaring and Starbucks (Nasdaq: SBUX) has raised prices in select markets. Those factors would appear to work in JO's favor, but the ETN continues to tumble. It's a short below $52. Market Vectors Junior Gold Miners ETF (NYSE: GDXJ) In this case, we should emphasize GDXJ has the POTENTIAL to disappoint this year. That would mean a sequel to what investors had to contend with in 2011 when ETFs like GLD rose, but funds like GDXJ lagged in a big way. That said, if you're a believer in the January Effect, GDXJ might be a pleasant surprise in 2012. Since December 29, the ETF has surged almost 16% after finding support at $22. iPath DJ-UBS Cocoa TR Sub-Index ETN (NYSE: NIB) When an investor buys the iPath DJ-UBS Cocoa TR Sub-Index ETN, he or she is put in an interesting position. Beyond hoping for bad weather that could crimp cocoa supplies, cheering for political instability in major cocoa-producing nations is part of the deal as well. Well, that could easily happen since Ivory Coast and Ghana are the world's two largest cocoa producers, but it's not happening right now. In fact, cocoa shipments from those two countries are rising. Chocolate is sweet. NIB's performance is not. The ETN has been crushed in the past year. Teucrium WTI Crude Oil Fund (NYSE: CRUD) Let's clear up the inclusion of CRUD on this list. We are not extolling a bearish view on oil. In fact, CRUD is a useful fund for traders looking for a contango-fighting oil play. However, the potential disappointment comes in the form of CRUD's expense ratio of 1.58%. That's high, though not all that terrible by the standards of oil futures ETFs and ETNs. Then again, it's fees like that make equities-based ETFs more economical plays on rising oil prices. Bottom line: CRUD's expense ratio will eat away at your returns."
2012-01-11,Why Ron Paul's Proposed Military Cuts Could Ruin the Economy,"Perhaps the most intriguing development in the Republican US presidential nomination race has been the ascendancy of Ron Paul. Although it seems unlikely that he can win the nomination, he’s managed to carve out a dedicated support base of voters. The key to his appeal has been his back to basics approach. He wants to drastically cut taxes, balance the budget, and severely limit the powers of the government. Only through a free market, Paul believes, can America return to prosperity. One way he would achieve his goal of a balanced budget is by cutting government spending on the military. War is never economically beneficial except for those in position to profit from war expenditures, Paul said in the US House of Representatives back in 2004. Taken at face value, Paul’s arguments against military spending can be persuasive. Yet, it ignores certain, important realities. The US federal, state, and local governments now spend about $6 trillion - or 40% of the nation's GDP - annually. This spending is directly responsible for 20% of the production cited in the official US GDP number, which is currently at about $15 trillion according to the International Monetary Fund. The federal government spent roughly $1 trillion of its budget on national defense in 2011. That estimate includes the budget of the Department of Defense ($700 billion) and Department of Homeland Security, “international assistance” costs, interest payments on debts from past wars, and spending by other agencies like the Department of Energy or CIA on programs that can be considered part of the country’s national defense strategy. So, let’s say that Paul is elected president and manages to cut the national defense budget in half. Now, the US is only spending $500 billion. At first glance, that seems like a modest cut, especially considering Paul’s fierce anti-spending stance. He'd want to cut more than that. Still, the effects on the US economy would be immediate and painful. Assuming that the US GDP is still $15 trillion, such cuts would reduce the national GDP to about $14.7 trillion, a 2% loss. In 2010, the US GDP only grew by 3.03%, and much of that growth can be directly attributed government spending. In the two years before that, US GDP growth was negative. A 2% loss in GDP from spending cuts – which would be impossible to replace right away - would make posting positive quarterly GDP numbers that much more difficult. For example, half of GDP growth in 2Q 2010 was from government spending. Weak or negative GDP numbers would wreak havoc on the markets and could easily plunge the US into full-fledged recession. That would be bad news for most investors. The US economy has been slow to recover since 2008, and can’t afford many major setbacks. Maybe the only stocks that would truly benefit from such news would be gold and, to a lesser extent, silver stocks. Gold and silver have long been viewed as safe havens in times of crises. It should come as no surprise that 64% of Paul’s investment portfolio is in gold and silver mining stocks. If Paul was elected president, or if his budget ideas were ever adopted in full, it might be wise to join him and invest in Market Vectors Junior Gold Miners ETF (NYSE: GDXJ) or Global X Silver Miners (NYSE: SIL). Of course, the traditional counter-argument to claims that government spending is necessary is that any loss in spending would be offset by the savings that could be passed onto Americans through tax cuts. It’s a position often championed by Paul. However, Americans are already paying the lowest share of their income in taxes since 1958. When they do have more spending money, they tend to quickly pass it on to the developing countries that produce the goods Americans covet most. Apple’s (NASDAQ: APPL) iPhone alone added about $2 billion to the US trade deficit in 2009. Furthermore, the gains in GDP from retail spending are often not as pronounced as the headlines would have the public believe. In fact, only about 44% of consumer spending is in retail. Though the official corporate tax rate seems high at 35% for corporations making over $18,333,333 a year, thanks to loopholes the federal government is actually collecting less in taxes as a percentage of GDP from major corporations than it used to. Would General Electric (NYSE: GE) - which paid zero US taxes in 2010 – invest more in the US if corporate tax rates were lowered? Or what about Exxon Mobil (NYSE: XOM), which managed to pay nothing in US income taxes in 2009? The answer to both is probably not. Instead, major corporations would likely continue to invest abroad, where developing markets presently offer more attractive growth potential. Small businesses are often viewed as the main employers in the US, but recent tax breaks for small businesses have also done little to stimulate US hiring. Many small business owners maintained that they would only hire more if the economy recovered. Underemployment in the US remains rampant. If the US economy is going to recover to pre-2008 levels, government investment will have to be one of the main drivers. In an economy where corporations are heavily investing in foreign countries and one-fifth of the GDP depends on government spending, it’s too late for Paul to preach small government. Cutting the national defense budget at time like this would be shortsighted, and not just because of its direct effect on the GDP. CNN Money called weapons the hottest export in the US in early 2011, and Obama has identified weapon sales as one of the keys to increasing US exports over the next half-decade. Without the government’s national defense spending, the arms industry would quickly whither. Defense contractors like Lockheed Martin (NYSE: LMT), Boeing (NYSE: BA), Northrop Grumman (NYSE: NOC), and General Dynamics (NYSE: GD) would be hit hard. Those companies are expecting some downturns in the arms market even without Paul’s proposed cuts. Eventually, spending cuts have to happen. Standard & Poor’s downgrading of the US credit rating last summer proves that major federal budget deficits can’t go on forever. That being said, kneejerk reactions like Paul’s proposal to cut $1 trillion in spending and eliminate five cabinet departments in one year would be disastrous for the economy. Government spending will need to be reined in gradually over time. Otherwise, the US economy will quickly be in for a world of hurt."
2012-01-31,"ETFs to Watch February 1, 2012","Here is the ETF Professor's ETF Watch List For Wednesday Feb. 1, 2012. Hot plays: Global X Social Media ETF (Nasdaq: SOCL) and the Market Vectors Junior Gold Miners ETF (NYSE: GDXJ). Keep an eye on the iShares Dow Jones US Oil Equipment Index Fund (NYSE: IEZ). The U.S. Natural Gas Fund (NYSE: UNG) remains a good short. Emerging markets plays of the day: iPath MSCI India Index ETN (NYSE: INP), Direxion Daily Russia Bear 3X Shares (NYSE: RUSS) and the Global X China Industrials ETF (NYSE: CHII). Forex play of the day: PowerShares DB Dollar Bullish (NYSE: UUP). Bond play of the day: WisdomTree Asia Local Debt ETF (NYSE: ALD)."
2012-02-14,"ETFs to Watch February 15, 2012","Here is the ETF Professor's ETF Watch List for Wednesday February 15, 2012. The ProShares UltraShort S&P500 (NYSE: SDS) is worth a look as the S&P 500 struggles with 1,350. The Market Vectors Junior Gold Miners ETF (NYSE: GDXJ) continues to struggle. The Materials Select Sector SPDR (NYSE: XLB) could be in technical trouble. Emerging markets plays of the day: ProShares UltraShort Brazil (NYSE: BZQ), Direxion Daily Latin America Bear 3X Shares (NYSE: LHB) and the Guggenheim China Real Estate ETF (NYSE: TAO). Bond play of the day: PowerShares Build America Bond ETF (NYSE: BAB). Forex play of the day: PowerShares DB Dollar Bullish (NYSE: UUP)."
2012-02-28,"Breakout: ETFs on the Verge of Big Things (HAO, FCG, KBE)","With stocks continuing to grind higher, latecomers to the party might be feeling as if they missed out on some good moves. They have, but hey, no one is perfect and the good news is there's a fair amount of non-leveraged ETFs that are worth a look right now. By worth a look, we mean those funds that are still a considerable distance away from their 52-week highs and that are on the verge of significant technical breakouts. There's more good news: The five ETFs we've selected that meet the aforementioned criteria would make for a diverse portfolio on their own as various sectors and countries are found in our group. Guggenheim China Small Cap ETF (NYSE: HAO) The Guggenheim China Small Cap ETF has surged almost 50% off its October bottom and that statistic might keeping new capital on the sidelines regarding this fund. That's understandable, but remember: Chinese ETFs have been strong this year, emerging markets in general have impressed and small-cap funds have been stout as well. HAO has that combination. It has the potential for significant upside if it can crack $24 on strong volume. Asking for the 52-week high of just over $30 in the near-term might be a little greedy, but a move to the high $20s in the next couple of months isn't out of the realm of possibility. First Trust ISE-Revere Natural Gas Index Fund (NYSE: FCG) FCG is useful for a surprising amount of sub-plots in the energy space, not the least of which is increased mergers and acquisitions activity and the move by many companies away from natural gas production to increased oil output. So on those two points alone, FCG has merit. The ETF has been a solid, but not yet jaw-dropping performer in 2012 and that's actually appealing. Should FCG clear $20, an area that proved to be serious resistance three times last year, seeing this ETF go to $22-$23 is plausible. SPDR S&P Bank ETF (NYSE: KBE) Resurgent bank stocks have been a nice bonus for wary investors in 2012 and for those that just couldn't decide which one to settle on, ETFs have served their purpose. With KBE up almost 13% year-to-date and almost 33% since October, it would be wise to wait for the ETF to clear what is proving to be some stiff resistance around $22.60. KBE has been able to peak through a couple of times recently, but can't stick above an uptrend line. That's what needs to happen for a legitimate breakout to be confirmed here. Market Vectors Junior Gold Miners ETF (NYSE: GDXJ) Now this is one that run hard and fast should it clear its next major technical hurdle. After struggling to keep pace with bullion for almost all of 2011, mining ETFs have gotten their acts together in 2012. GDXJ recently emerged from a reverse head and shoulders formation and is now dealing with some resistance just pennies above current levels. That's not the only hurdle. The ETF also needs to reclaim its 200-day line just below $31 and $31 looks like horizontal resistance. In other words, if GDXJ can accomplish all of those feats, it would be an overtly bullish sign. Global X FTSE ASEAN 40 ETF (NYSE: ASEA) Another ETF that has a solid fundamental resume ASEA has been having a solid, but unspectacular 2012 by the standards of emerging markets ETFs. A strong volume move above $16.40 could lead to upside of 10% from there."
2012-02-28,Small Cap Gold Stocks Successfully Retest 2010 Breakout,"By Jordan Roy-Byrne, The Daily Gold When one speaks of gold stocks they should be more specific as the sector is diverse. The term Gold stocks usually refers to the large unhedged producers. Indices such as the HUI or GDX track these stocks and are a proxy for the gold stock universe. However, most companies in the sector are much smaller. We hear the term “juniors” so often and that is what makes it inconsistent. Juniors are typically micro-cap exploration companies. Yet, GDXJ the junior ETF is comprised of companies with market caps in the $500 Million to $1 Billion range. There is nothing junior about that. We notice there is a gap in terms of terminology. If Juniors are sub- $100 Million, and large caps are over $1 Billion, then what do you call those that fit the gap? We prefer to use the term “established juniors” or small cap. After all, small caps by definition are in market cap between $100 Million and $1 Billion. These terms are most appropriate for those in the middle of said range rather than the bottom or top. We prefer the established juniors as being established (which is open to interpretation) they have less risk than the true juniors and if successful can grow to $1 Billion or more in capitalization. In our opinion, small caps are the area to focus on as they have a much greater likelihood of growth and leverage to Gold than the large producers. Historically, the large producers do not outperform Gold on a consistent basis. The law of numbers combined with the difficulty of the mining business explains why. Our junior/small cap index consists of 20 stocks equally weighted with a median market cap of about 600 Million. In the second half of 2010 the market broke to new highs for the first time since 2007. With every breakout comes a retest. Heading into 2011 we predicted the retest would last into the summer. The retest lasted the entire year but appears to be successful. Our bet is that the small caps will work their way back to the high before the end of the summer. It will take the time to overcome resistance but the trend will remain higher. If and when the market makes a new all-time high it will be very bullish for several reasons. It would be the first sustained breakout to a new all-time high since 2005-2006. It would come at a time when the bull market is starting to transition out of the wall of worry phase. Finally, it would generate significant momentum when overhead resistance is basically nil. This is possible due to a combination of Gold rising and present low valuations improving. In the next chart we graph our index and the ratio of our index to Gold. Gold companies are generating record profits and the price of Gold is near its all-time high yet leveraged small caps are trading near a low relative to Gold. That, in our view is a function of market sentiment and evidence of the wall of worry stage. If the ratio would rise back to its 2007 and 2010 highs at 0.065 and Gold would reach $2000, our small cap index would just about double. That is right, a potential 100% gain. The bottom line is small cap gold stocks have completed a textbook breakout and retest. As we said, the market will likely have a hard slog for the next several months as it encounters supply from the 2011 correction. If and when the market nears its old high it will have built up the necessary strength and momentum to embark on an explosive breakout. Thus, now is the time to be doing your due diligence to find and research those candidates to lead the market in a potential rip roaring move into 2013. If you'd be interested in professional guidance in this endeavour then we invite you to learn more about our service. Jordan Roy-Byrne, CMT"
