created,title,body
2013-06-24,Reverse Splits Coming For 7 Market Vectors ETFs,"Market Vectors, the New York-based ETF issuer known for its suite of emerging markets and unique bond ETFs, announced reverse splits for seven of its ETFs. Three of the the funds that will be reverse split are single-country emerging markets ETFs while the three of the remaining four are equity-based commodities funds. The effective date of the split will be at market open on July 1, 2013, according to a statement issued by Market Vectors. The Market Vectors Global Alternative Energy ETF (NYSE: GEX), the Market Vectors Russia Small-Cap ETF (NYSE: RSXJ) and the Market Vectors Uranium+Nuclear Energy ETF (NYSE: NLR) will be reverse split on a 1-for-3 basis. The Market Vectors Egypt Index ETF (NYSE: EGPT), the Market Vectors India Small-Cap Index ETF (NYSE: SCIF), the Market Vectors Junior Gold Miners ETF (NYSE: GDXJ) and the Market Vectors Rare Earth/Strategic Metals ETF (NYSE: REMX) will be reverse split on a 1-for-4 basis. GDXJ has $1.2 billion in assets under management, making it fair to call the ETF popular by any metric. Even legendary financier George Soros held a stake in the ETF at the end of the first quarter. The ETF has not rewarded investors' faith. GDXJ, like every other ETF tracking gold miners, has struggled mightily for over a year. At the start of 2013, the fund traded above $20. At this writing, the fund trades below $8.90. For more on ETFs, click here."
2013-06-26,SLIDESHOW: Top Stocks For The DOMA Ruling,"Wednesday morning, the Supreme Court rejected the 17-year ban on same-sex marriage being federally recognized as unconstitutional in its critical Defense of Marriage Act ruling. The move was very close as the Supreme Court voted 5-4 in favor of ruling the law unconstitutional, a good view of the divide in the U.S. on the subject. For markets, there could be a direct impact of the ruling. Several stocks are sensitive to wedding seasons and others could simply benefit from an increase in travel and other wedding related expenses. Benzinga broke down a host of stocks and ETFs that could be impacted from the DOMA decision."
2013-06-26,Stocks For The DOMA Ruling,"The Supreme Court Wednesday morning rejected the 17-year ban on same-sex marriage being federally recognized as unconstitutional in its critical Defense of Marriage Act ruling. The move was very close as the Supreme Court voted 5-4 in favor of ruling the law unconstitutional, a good view of the divide in the U.S. on the subject. For markets, there could be a direct impact of the ruling. Several stocks are sensitive to wedding seasons and others could simply benefit from an increase in travel and other wedding related expenses. Benzinga breaks down a host of stocks and ETF's that could be impacted from the DOMA decision."
2013-07-15,The Tape Says Take Profits And Run When Mining ETF Bounces,"Some stocks, Apple (NASDAQ: AAPL) being a prime example, develop cult followings. Sometimes that is a good thing, but often times it is not. After all, members of a cult have, to put things delicately, given away their freedom of thought. Some ETFs accrue cult followings over time, too. Gold mining ETFs, such as the group's largest fund, the Market Vectors Gold Miners ETF (NYSE: GDX), have some impassioned shareholders. Confirming that is as simple as heading over to Twitter where, last week, a certain ETF analyst was on the receiving end of some choice words from gold mining bulls after those stocks spiked when Federal Reserve Chairman Ben Bernanke implied quantitative easing tapering may not be as imminent as some previously thought. In this space, we've been bearish on gold mining ETFs for some time. One can timestamp that bearishness back to at least May 2012, when we wondered what happens to ETFs that slump back to their debut prices. Funds highlighted in that story include GDX and the Market Vectors Junior Gold Miners ETF (NYSE: GDXJ), a fund that was recently reverse split. RELATED: Four Things Einhorn, Soros Are Forgetting About Gold Miners ETF Since then, we have wondered aloud if things can actually get worse for mining ETFs. Then we proved that even really, really smart guys like David Einhorn, John Paulson and George Soros have struggled with mining stocks and ETFs. Overall, we have offered up plenty of analysis and coverage of what has generally been an awful time to hold mining ETFs for any more than a few days here and there. In the U.S., everyone is entitled to free speech, including giving other folks a hard time on Twitter. No problem at all, but here is a fact: GDX is down almost 43 percent since our piece questioning the validity of being long GDX and GDXJ was published on May 11, 2012. More importantly, this piece is not about being right. It is about what happens after GDX notches a good day or a few good days. Since those instants have been rare over the past year, the sample set is easy to establish. From September 12-14, 2012, GDX gained 7.6 percent. By October 15, the fund had lost 4.1 percent. Not too bad for an ETF this volatile, but there are other examples of GDX not being able to hold a few days of gains. From November 5-8, 2012, GDX gained about $2 to close at $51.41 on November 8. On November 15, the ETF closed below $46. From February 20-27, 2013 GDX traded modestly higher from $37.45 to $39.05. By April 17, the ETF had plunged to just over $27. May 17 through June 3 was a nice time to own GDX as the ETF went from $26.38 to $30.36. Holding the fund through June 22 was not wise as it dropped nearly 27 percent. However, by June 28, GDX was back to almost $24.50. By July 8, the ETF closed at $22.90. Bottom line: There very well could come time that gold miners rally and rally big-time. However, the tape proves that being long GDX and rival funds over the past 12-16 months has been difficult to say the least. Indeed, these ETFs have made for some good TRADES, but terrible long-term holds. Translation: If you catch five, six or seven percent in GDX or a comparable ETF in just a few days, do not wait and take something off the table. For more on ETFs, click here."
2013-07-23,Put a RING on it With This ETF,"You might have heard that the good times for gold are back. At least temporarily. Bullion enjoyed its best intraday performance in over a year Monday, a move that was strong enough to put the SPDR Gold Shares (NYSE: GLD) within pennies of its 50-day moving average, something GLD has not traded above since early this year. Embattled gold miners are getting in on the act. Or maybe, for once, they are leading the way. The Market Vectors Gold Miners ETF (NYSE: GDX) now resides somewhat comfortably above its 50-day line. In the past month while GLD is up four percent, GDX gained 15.5 percent heading into the startof trading Tuesday. All that after gold miners had been maligned and at least five gold mining ETFs, including the popular Market Vectors Junior Gold Miners ETF (NYSE: GDXJ) and the Direxion Daily Gold Miners Bull 3X Shares (NYSE: NUGT), were reverse split earlier this year. Should this rally gold miners rally be sustainable, investors may want to consider an ETF with RING). RING debuted at the end of January 2012 and is a direct competitor to GDX, the king of gold mining ETFs. The two have plenty similarities and that is nice way of saying that, until the past few weeks, both have been destroyers of capital as both down more than 40 percent year-to-date. Investors that bank on GDX are, whether they know it or not, are banking on Goldcorp (NYSE: GG) and Barrick (NYSE: ABX) as those stocks combine for 25 percent of that fund's weight. With RING, that number rises to 28 percent. A key difference between the two ETFs, in addition to the fact that RING has nine more holdings at 39 than GDX's 30, is that the latter offers some decent exposure to silver miners. Silver Wheaton (NYSE: SLW) is a top-10 holding in GDX while Cia de Minas Buenaventura (NYSE: BVN) receives a weight of 3.7 percent. Pan American Silver (NASDAQ: PAAS) is 2.2 percent of GDX's weight. Buenaventura is a RING holding, too, but overall that ETF is light on pure-play silver miners. In theory, the difference in silver miners allocations should make a noticeable difference in terms of performance between GDX and RING. Although silver miners have joined in on the precious metals mining resurgence with the Global X Silver Miners ETF (NYSE: SIL) surging 20 percent in the past month, that has not lead to a significant performance gap between GDX and RING. The edge goes to GDX, but the result is a gain of 15.54 percent to 15.45 percent for RING. Both funds are inexpensive on valuation with GDX sporting a price-to-book ratio of 0.95 at the end of June while RING's was 0.89. Deciding between the two is actually not difficult. GDX's average daily volume of over 26.1 million shares means it is the superior bet for active traders, but RING's 0.39 percent expense ratio (13 basis points cheaper than GDX's) indicates the fund is a credible option for those daring enough to make long-term bets on gold miners. For more on ETFs, click here."
2013-07-24,"If Mining Rally is Legitimate, Don't Forget These ETFs","Traders appear to be taking some profits in gold miners and the corresponding ETFs Wednesday and that is not surprising. The Market Vectors Gold Miners ETF (NYSE: GDX) and its small-cap counterpart, the Market Vectors Junior Gold Miners ETF (NYSE: GDXJ) are both down 3.2 percent. That might sound bad, but consider that since the start of July GDX was up almost 14 percent heading into Wednesday and GDXJ was up 19.6 percent. Some profit-taking was due to occur at some point. While the recent upside moves by various mining ETFs have been impressive, the track record for these funds and their constituents over the past 18 to 24 months has been ominous at best. That could mean some investors might need some more cajoling to truly embrace mining stocks and ETFs. Compelling valuations and the potential for a sustained rally in gold and silver prices are fundamental factors that could bode well for further upside for the miners. If that scenario comes to fruition, some obscure ETFs may be also be worthy of consideration. PureFunds ISE Junior Silver ETF (NYSE: SILJ) When it comes to silver mining ETFs, the Global X Silver Miners ETF (NYSE: SIL) is the dominant name, though that fund has a rival in the form of the iShares MSCI Global Silver Miners ETF (NYSE: SLVP). Over the past month, either SIL or SLVP made for a great choice as the two are up an average of about 23 percent. No one would quibble over returns like that, but the PureFunds ISE Junior Silver ETF has surged 27 percent over that time. Think of SILJ as the GDXJ of silver mining ETFs. Yes, there are some small-caps in SIL and SLVP, but the newly minted SILJ is the first pure-play ETF to exclusively hold silver explorers and junior silver producers, according to PureFunds. Silvercorp (NYSE: SVM) and Fortuna Silver (NYSE: FSM), SILJ's two largest holdings, have an average market cap of about $500 million. Those stocks combine for over 24 percent of the ETF's weight. IndexIQ Australia Small-Cap ETF (NYSE: KROO) Slowing economic growth in China, the looming end of the Australian mining boom and, yes, falling gold prices have been among the reasons Australia ETFs have disappointed this year. Now that gold prices are rebounding, so are Australia ETFs. The iShares MSCI Australia ETF (NYSE: EWA) is up 5.4 percent in the past month, but the better of playing Australia's status as one of the world's largest gold producers is with the IndexIQ Australia Small-Cap ETF. KROO has proven as much with a one-month gain of 12 percent. KROO has 22.8 percent weight to the materials sector, which is 450 basis points higher than EWA's exposure to the same sector. The small-cap fund also gives investors exposure to improvement in Australian economic data as consumer discretionary names account for over 26 percent of the fund's weight. Global X Pure Gold Miners ETF (NYSE: GGGG) The Global X Pure Gold Miners ETF, a recent victim of a reverse split, has fought back to surge 22 percent in the past month. That is one of the best one-month run among mining ETFs, though hardly anyone has noticed because of GGGG's size (just $3.6 million in assets under management). On the surface, GGGG appears to be a copycat of GDX and the funds do share a few of the same holdings. However, GGGG is not heavily allocated to mining giants such as Goldcorp (NYSE: GG) and Barrick (NYSE: ABX) as GDX is. In fact, those stocks are not even found among GGGG's 23 holdings. The Global X offering has a heavy international bias as the U.S. receives a weight of just under five percent, the same as Kazakhstan. Canada, Australia and South Africa combine for about 70 percent of the ETF's country weight. For more on ETFs, click here."
2013-07-24,These ETFs Are Beating The Reverse Split Curse,"Though more apt to happen with leveraged funds, reverse splits are a fact of life in the world of ETFs. Proving that traditional long ETFs have be subject to reverse splits, since the start of May, six Global X funds and seven Market Vectors products have been reverse split. It is not a stretch to say that, at least officially, no ETF sponsor is going to acknowledge the reverse split curse. Then again, superstitious football players are reluctant to talk about the the Madden video game cover curse. A curse may just be in one's imagination, but the iPath S&P 500 VIX Short-Term Futures ETN (NYSE: VXX) has undergone multiple reverse splits over the years, but its chart still looks like this. However, some ETFs that have previously traveled down Reverse Split Boulevard have recently been stellar performers. Consider the following. Alternative Energy Specifically, solar ETFs. The Guggenheim Solar ETF (NYSE: TAN) and the Market Vectors Solar Energy ETF (NYSE: KWT) were both reverse split in 2012, also known as the dark days for solar stocks. This year has brought a stunning reversal of fortune for solar ETFs as TAN and KWT are the two best-performing non-leveraged ETFs. However, there is a big gap between the two, 2,7000 basis points in favor of TAN because TAN features a larger weight to First Solar (NASDAQ: FSLR), among other reasons. TAN also includes Elon Musk's Solar City (NASDAQ: SCTY) among its lineup. KWT does not. The Market Vectors Global Alternative Energy ETF (NYSE: GEX) was recently reverse split, though this was somewhat strange since the ETF was performing well and trading in the double-digits. In fact, GEX is the third-best non-leveraged ETF this year behind TAN and KWT. GEX has an 11.4 percent weight to some company called Tesla (NASDAQ: TSLA) and that is probably helping the ETF surge this year. Gold Miners The recent list of ETFs to be reverse split since the start of May includes four gold miners funds. That group includes the popular Market Vectors Junior Gold Miners ETF (NYSE: GDXJ). It is no secret that gold miners have bounced in a big way in recent weeks. Even when including today's 3.5 percent loss, GDX is up more than 21 percent since July 2, the day after its reverse split went into effect. Three of the Global X ETFs that were recently reverse split were GLDX), the Global X Junior Gold Miners ETF (NYSE: JUNR) and the Global X Pure Gold Miners ETF (NYSE: GGGG). In the past month, that trio is up an average of 25.4 percent. The Direxion Daily Gold Miners Bull 3X Shares (NYSE: NUGT) was reverse split on April 2 and its total performance since then is dreadful, but holding leveraged ETFs for four months at a time is a no-no. Four weeks is a different story and over the past four weeks, NUGT was up 54 percent heading into the start of trading Wednesday. For more on ETFs, click here."
2013-07-24,These ETFs are Beating the Reverse Split Curse,"Though more apt to happen with leveraged funds, reverse splits are a fact of life in the world of ETFs. Proving that traditional long ETFs have be subject to reverse splits, since the start of May, six Global X funds and seven Market Vectors products have been reverse split. It is not a stretch to say that, at least officially, no ETF sponsor is going to acknowledge the reverse split curse. Then again, superstitious football players are reluctant to talk about the the Madden video game cover curse. A curse may just be in one's imagination, but the iPath S&P 500 VIX Short-Term Futures ETN (NYSE: VXX) has undergone multiple reverse splits over the years, but its chart still looks like this. However, some ETFs that have previously traveled down Reverse Split Boulevard have recently been stellar performers. Consider the following. Alternative Energy Specifically, solar ETFs. The Guggenheim Solar ETF (NYSE: TAN) and the Market Vectors Solar Energy ETF (NYSE: KWT) were both reverse split in 2012, also known as the dark days for solar stocks. This year has brought a stunning reversal of fortune for solar ETFs as TAN and KWT are the two best-performing non-leveraged ETFs. However, there is a big gap between the two, 2,7000 basis points in favor of TAN because TAN features a larger weight to First Solar (NASDAQ: FSLR), among other reasons. TAN also includes Elon Musk's Solar City (NASDAQ: SCTY) among its lineup. KWT does not. The Market Vectors Global Alternative Energy ETF (NYSE: GEX) was recently reverse split, though this was somewhat strange since the ETF was performing well and trading in the double-digits. In fact, GEX is the third-best non-leveraged ETF this year behind TAN and KWT. GEX has an 11.4 percent weight to some company called Tesla (NASDAQ: TSLA) and that is probably helping the ETF surge this year. Gold Miners The recent list of ETFs to be reverse split since the start of May includes four gold miners funds. That group includes the popular Market Vectors Junior Gold Miners ETF (NYSE: GDXJ). It is no secret that gold miners have bounced in a big way in recent weeks. Even when including today's 3.5 percent loss, GDX is up more than 21 percent since July 2, the day after its reverse split went into effect. Three of the Global X ETFs that were recently reverse split were <a href=http://www.benzinga.com/news/13/05/3555694/global-x-to-reverse-split-3-gold-miners-etfs-3-others>mining funds: The Global X Gold Explorers ETFs (NYSE: mining funds: The Global X Gold Explorers ETFs (NYSE: GLDX), the Global X Junior Gold Miners ETF (NYSE: JUNR) and the Global X Pure Gold Miners ETF (NYSE: GGGG). In the past month, that trio is up an average of 25.4 percent. The Direxion Daily Gold Miners Bull 3X Shares (NYSE: NUGT) was reverse split on April 2 and its total performance since then is dreadful, but holding leveraged ETFs for four months at a time is a no-no. Four weeks is a different story and over the past four weeks, NUGT was up 54 percent heading into the start of trading Wednesday. For more on ETFs, click here."
2013-07-24,"ETFs to Watch July 24, 2013 (AMLP, EUO, JNK)","Here is the ETF Professor's ETF Watch List for Wednesday, July 24, 2013. The Market Vectors Coal ETF (NYSE: KOL) has been perking up. So has the Market Vectors Junior Gold Miners ETF (NYSE: GDXJ). Keep an eye on the First Trust ISE-Revere Natural Gas Index Fund (NYSE: FCG). Give the ALPS Alerian MLP ETF (NYSE: AMLP) a look. Emerging markets plays of the day: ProShares UltraShort FTSE China 25 (NYSE: FXP), iShares MSCI South Korea ETF (NYSE: EWY) and the WisdomTree Emerging Markets Equity Income Fund (NYSE: DEM). Forex play of the day: ProShares UltraShort Euro (NYSE: EUO). Bond play of the day: SPDR Barclays Capital High Yield Bond ETF (NYSE: JNK)."
2013-08-13,"ETFs to Watch August 13, 2013 (EWT, GDXJ, SOCL)","Here is the ETF Professor's ETF Watch List for Tuesday, August 13, 2013. Keep an eye on the iShares MSCI Australia ETF (NYSE: EWA). The Market Vectors Junior Gold Miners ETF (NYSE: GDXJ) will certainly be in play as will the ProShares Ultra Silver (NYSE: AGQ). Give the U.S. Natural Gas Fund (NYSE: UNG) a look. Consider the Global X Social Media Index ETF (NYSE: SOCL). Emerging markets plays of the day: Market Vectors Brazil Small-Cap ETF (NYSE: BRF), iShares MSCI Taiwan ETF (NYSE: EWT) and the iShares MSCI All Peru Capped ETF (NYSE: EPU). Forex play of the day: CurrencyShares Australian Dollar Trust (NYSE: FXA). Bond play of the day: WisdomTree Emerging Markets Local Debt ETF (NYSE: ELD)."
2013-08-16,"ETFs To Watch August 16, 2013 (BOND, GDXJ, YCS)","Here is the ETF Professor's ETF Watch List for Friday August 16, 2013. Give the iShares MSCI USA Minimum Volatility ETF (NYSE: USMV) a look. The ProShares UltraShort Oil & Gas (NYSE: DUG) is worth a trade. The Market Vectors Junior Gold Miners ETF (NYSE: GDXJ) is on fire. The SPDR S&P Dividend ETF (NYSE: SDY) is breaking down. Emerging markets plays of the day: Market Vectors Egypt ETF (NYSE: EGPT), iShares MSCI Frontier 100 ETF (NYSE: FM) and the Market Vectors Brazil Small-Cap ETF (NYSE: BRF). Forex play of the day: ProShares UltraShort Yen (NYSE: YCS). Bond play of the day: PIMCO Total Return ETF (NYSE: BOND)."
2013-08-16,"ETFs to Watch August 16, 2013 (BOND, GDXJ, YCS)","Here is the ETF Professor's ETF Watch List for Friday August 16, 2013. Give the iShares MSCI USA Minimum Volatility ETF (NYSE: USMV) a look. The ProShares UltraShort Oil & Gas (NYSE: DUG) is worth a trade. The Market Vectors Junior Gold Miners ETF (NYSE: GDXJ) is on fire. The SPDR S&P Dividend ETF (NYSE: SDY) is breaking down. Emerging markets plays of the day: Market Vectors Egypt ETF (NYSE: EGPT), iShares MSCI Frontier 100 ETF (NYSE: FM) and the Market Vectors Brazil Small-Cap ETF (NYSE: BRF). Forex play of the day: ProShares UltraShort Yen (NYSE: YCS). Bond play of the day: PIMCO Total Return ETF (NYSE: BOND)."
2013-08-30,"ETFs to Watch August 30, 2013 (BSV, DTO, GDXJ)","Here is the ETF Professor's ETF Watch List for Friday, August 30, 2013. Keep an eye on the PowerShares DB Crude Oil Double Short ETN (NYSE: DTO). The ProShares UltraShort S&P 500 (NYSE: SDS) should be monitored. Give the First Trust Utilities AlphaDEX Fund (NYSE: FXU) a look. The Market Vectors Junior Gold Miners ETF (NYSE: GDXJ) should be in play, as always. Emerging markets plays of the day: iShares MSCI Chile ETF (NYSE: ECH), iShares MSCI Taiwan ETF (NYSE: EWT) and the Market Vectors Indonesia ETF (NYSE: IDX). Forex play of the day: CurrencyShares Canadian Dollar Trust (NYSE: FXC). Bond play of the day: Vanguard Short-Term Bond ETF (NYSE: BSV)."
2013-09-04,Big Gold Miners ETF To Stick With Current Index,"Following some previously announced changes to its underlying index, the Market Vectors Gold Miners ETF (NYSE: GDX) will continue tracking the NYSE Arca Gold Miners Index. Last month, it was revealed that the NYSE Arca Gold Miners Index would begin including more American depositary receipts and global depositary receipts while barring companies with market values below $750 million. Related: If Mining Rally Is Legitimate, Don't Forget These ETFs. The NYSE Arca Gold Miners Index is a modified market capitalization-weighted index, and provides exposure to publicly traded companies worldwide involved primarily in gold mining, representing a diversified blend of small-, mid- and large- capitalization stocks, according to the GDX web page. GDX is the largest gold miners ETF with $6.4 billion in assets under management. Goldcorp (NYSE: GG), Barrick Gold (NYSE: ABX) and Newmont Mining (NYSE: NEM) are the ETF's top-three holdings and combine for about 35 percent of the fund's weight. Changes to the index are expected to take place after September 20. After reviewing the improved methodology, we are pleased with the planned changes and expect them to be beneficial for investors, said Brandon Rakszawski, product manager with Market Vectors, in a statement. By moving to allow for the inclusion of non-U.S. listed companies, we believe the Index will better capture the global nature of the gold mining industry. Additionally, by increasing the minimum market cap for inclusion in the Index, the overall liquidity of GDX holdings may be improved . Market Vectors also issues the Market Vectors Junior Gold Miners ETF (NYSE: GDXJ). GDXJ, which has $1.8 billion in AUM, is benchmarked to an in-house index. For more on ETFs, click here. Disclosure: Author does not own any of the securities mentioned here."
2013-09-20,"Benzinga's Mandatory ETF Reading for September 20, 2013","Big winners (up at least 5%): ProShares UltraShort Silver (NYSE: ZSL), Direxion Daily Gold Miners Bear 3X Shares (NYSE: DUST), Direxion Daily Emerging Markets Bear 3X Shares (NYSE: EDZ) and the PowerShares DB Commodity Short ETN (NYSE: DDP). Big losers (down at least 5%): Market Vectors Gold Miners ETF (NYSE: GDX), Market Vectors Junior Gold Miners ETF (NYSE: GDXJ), Market Vectors Indonesia ETF (NYSE: IDX), iShares Silver Trust (NYSE: SLV), Global X Silver Miners ETF (NYSE: SIL) and the Direxion Daily Latin America Bull 3X Shares (NYSE: LBJ). Unusual volume (at least 5X ADV): Market Vectors Gaming ETF (NYSE: BJK), Guggenheim Timber ETF (NYSE: CUT), WisdomTree Global Natural Resources ETF (NYSE: GNAT), iShares MSCI Global Gold Miners (NYSE: RING) and the Global X Social Media Index ETF (NASDAQ: SOCL). Must reads of the day: Bloomberg: Get ready for Congress to muck up the markets again. The Economist: A smart look look at global GDP growth. Barron's: Gold miners wave good-bye to no tapering gains. ETF Trends: Now this, unfortunately, Kardashian bonds. Cheapest of the cheap emerging markets. Check out these new dividend ETFs. Don't forget to follow me on Twitter @ETFProfessor1."
