created,title,body
2010-03-18,Is The SPDR Gold ETF The Reason Behind The Massive Rally In Gold?,"“Clusterstock’s Chart of the Day makes the case that gold ETFs like the massive SPDR Gold Shares (GLD) have helped push prices higher in recent years by letting speculators bet on the precious metal. This “trigger-finger investor base” could exacerbate a crash when the momentum fades, the argument goes,” John Spence Reports From MarketWatch. Spence goes on to say, “With more than $40 billion in assets, GLD is the second-largest U.S.-listed ETF behind SPDR S&P 500 ETF (SPY). Huge inflows and the rise in gold prices have resulted in the fund’s assets more than doubling from $18 billion in September 2008, according to J.P. Morgan. The ETF holds more gold than many sovereign nations have stashed in their reserves.” “ETFs have allowed speculative buyers to rapidly move in and out of the asset, which has changed the nature of the investor base driving the metal’s marginal price,” Business Insider writes. “See, the gold buyers of the past didn’t have the hair-trigger trading capability of the present ETF group, and there was a time when gold was considered simply a store of value rather than a vehicle for making huge upside,” it adds. “Which is why some research firms have voiced concern about gold’s suspected dependency on fund flows for price support.” We have listed some options for investing in gold through ETFs below: LONG: The investment (GLD) seeks to replicate the performance, net of expenses, of the price of gold bullion. The trust holds gold, and is expected to issue baskets in exchange for deposits of gold, and to distribute gold in connection with redemption of baskets. The gold held by the trust will only be sold on an as-needed basis to pay trust expenses, in the event the trust terminates and liquidates its assets, or as otherwise required by law or regulation. The investment (GDX) seeks to replicate as closely as possible, before fees and expenses, the price and yield performance of the AMEX Gold Miners index. The fund generally normally invests at least 80% of its total assets in common stocks and American depositary receipts (ADRs) of companies involved in the gold mining industry. The fund is nondiversified. The Funds (GDXJ) investment objective is to replicate as closely as possible, before fees and expenses, the price and yield performance of the Market Vectors Junior Gold Miners Index (the “Junior Gold Miners Index”). For a further description of the Junior Gold Miners Index, see “Junior Gold Miners Index.” The objective of (SGOL) the newly listed shares is to reflect the performance of the price of Gold bullion, less the Trust’s operating expenses. The Trust is open ended and is designed for investors who want a cost-effective(1) and convenient(2) way to invest in Gold as well as diversify their Gold holdings. The investment (UGL) will seek to replicate, net of expenses, twice the performance of gold bullion as measured by the U.S. Dollar p.m. fixing price for delivery in London. The fund normally invests assets in financial instruments with economic characteristics twice the return of the index. It may employ leveraged investment techniques in seeking its investment objective. The investment (DGL) seeks to track the price and yield performance, before fees and expenses, of the Deutsche Bank Liquid Commodity Index – Optimum Yield Gold Excess Return. The index is a rules-based index composed of futures contracts on gold and is intended to reflect the performance of gold. The investment (DGP) seeks to replicate, net of expenses, twice the daily performance of the Deutsche Bank Liquid Commodity index – Optimum Yield Gold Excess Return. The index is intended to reflect changes in the market value of certain gold futures contracts and is comprised of a single unfunded gold futures contract. The objective (IAU) of the trust is for the value of its shares to reflect, at any given time, the price of gold owned by the trust at that time, less the trust’s expenses and liabilities. The trust is not actively managed. It receives gold deposited with it in exchange for the creation of baskets of iShares, sells gold as necessary to cover the trust’s liabilities, and delivers gold in exchange for baskets of iShares surrendered to it for redemption. The trust is not an investment company registered under the Investment Company Act of 1940 or a commodity pool for purposes of the Commodity Exchange Act. SHORT: The investment (DZZ) seeks to replicate, net of expenses, twice the inverse of the daily performance of the Deutsche Bank Liquid Commodity index – Optimum Yield Gold Excess Return. The index is intended to reflect changes in the market value of certain gold futures contracts and is comprised of a single unfunded gold futures contract. The investment (GLL) will seek to replicate, net of expenses, twice the inverse daily performance of gold bullion as measured by the U.S. Dollar p.m. fixing price for delivery in London. The fund normally invests assets in financial instruments with economic characteristics inverse to the index. It may employ leveraged investment techniques in seeking its investment objective. Related posts:Options Activity Shows Massive Bearish Butterfly Spread On The Gold ETF George Soros Is Very Confident In The Gold Bubble And The SPDR Gold ETF The SPDR Gold ETFs Holdings Dwarfs The Gold Stockpiles Of Many Central Banks"
2010-03-19,PLTM and CU: New First Trust ETFs Not Physically Backed,"First Trust launched two new ETFs on March 12: First Trust ISE Global Platinum Index Fund (PLTM) and First Trust ISE Global Copper Index Fund (CU). Their names sound like they are commodity ETFs, and perhaps even physically-backed commodity ETFs. However, they are equity funds that invest in stocks. First Trust probably should have added “producers,” “miners,” or “equity” to the names to avoid confusion. First Trust ISE Global Platinum Index Fund (PLTM) is based on an equity index called the ISE Global Platinum Index, which is designed to track public companies active in platinum-group metals mining based on revenue analysis. Platinum group metals include platinum, palladium, osmium, iridium, ruthenium, and rhodium. PLTM holds 25 stocks. The largest are MMC Norilsk Nickel JSC ADR 7.9%, Johnson Matthey Plc 6.9%, Eastern Platinum Ltd. 6.8%, Aquarius Platinum Ltd. 6.8%, Lonmin Plc 6.6%, Impala Platinum Holdings Limited 6.5%, Anglo Platinum Limited 6.1%, and Stillwater Mining Company 6.0%. Top country exposure includes Canada 24.4%, South Africa 22.2%, United Kingdom 17.2%, Australia 15.6%, Russia 7.8%, and United States 6.1%. The fund has an expense ratio of 0.70%. Additional information can be found in the PLTM summary and other resources in the PLTM documentation list. First Trust ISE Global Copper Index Fund (CU) is based on an equity index called the ISE Global Copper Index, which is designed to track public companies active in the copper mining industry based on revenue derived from the sale of copper. CU holds 27 stocks, the largest being BHP Billiton Ltd 6.8%, Xstrata Plc 6.8%, Antofagasta Plc 6.7%, Freeport-McMoRan Copper & Gold, Inc. (Class B) 6.5%, Southern Copper Corporation 6.2%, and MMC Norilsk Nickel JSC ADR 5.0%. Top country exposure includes Canada 42.3%, United Kingdom 27.1%, United States 13.0%, Australia 6.8%, Russia 5.0%, and Peru 3.0%. Although Chile produces about a third of the world’s copper, its major players are not publicly traded. The fund has an expense ratio of 0.70%, and additional information can be found in the CU summary and other resources in the CU documentation list. With the introduction of PLTM and CU, investors now have the ability to invest in platinum and copper producers in much the way that Market Vectors Gold Miners (GDX) and Market Vectors Junior Gold Miners (GDXJ) provide access to gold producers. Whether or not there is investor demand for indexed products covering non-gold metal-specific mining companies remains to be seen. Ron Rowland Invest With An Edge Related Articles03/12/10 -- Six More ETFs From Direxion11/07/08 -- This Market is Not Risky Enough"
2010-03-22,Increased Global Demand Will Support The Price Of Gold ETFs,"“Gold prices over the past week have been teetering in positive, negative and somewhat uncertain territory. But there is confidence that the price of bullion will increase this year. One factor that is likely to support the price of the precious metal is the fact that central banks around the world have been hoarding the commodity and are reluctant to sell it. In fact, some bullion analysts expect the central banks of China, Russia and India to continue to gobble up gold as they move away from sovereign bonds and seek safer investments,” Kevin Grewal Reports From The Street. Grewal goes on to say, “A second factor likely to support the price of the yellow metal is the expected increase in global demand for base metals. There is an indirect correlation between the two types of metals, and in general as the prices of base metals increase so do those of gold. Thirdly, investor appetite for safe-haven tools is expected to continue to rise as sovereign debt issues in Europe, particularly Greece, continue to make headlines and remain a concern.” “Lastly, the Federal Reserve’s decision to keep interest rates at or near zero is likely to result in a loss of purchasing power, which could result in the U.S. dollar declining and make gold appealing to foreign investors and painting a macroeconomic backdrop which may support gold’s price,” Grewal Reports. We put together a list of some Gold ETFs to play if you believe in Golds increased global demand below: LONG: The investment (GLD) seeks to replicate the performance, net of expenses, of the price of gold bullion. The trust holds gold, and is expected to issue baskets in exchange for deposits of gold, and to distribute gold in connection with redemption of baskets. The gold held by the trust will only be sold on an as-needed basis to pay trust expenses, in the event the trust terminates and liquidates its assets, or as otherwise required by law or regulation. The investment (GDX) seeks to replicate as closely as possible, before fees and expenses, the price and yield performance of the AMEX Gold Miners index. The fund generally normally invests at least 80% of its total assets in common stocks and American depositary receipts (ADRs) of companies involved in the gold mining industry. The fund is nondiversified. The Funds (GDXJ) investment objective is to replicate as closely as possible, before fees and expenses, the price and yield performance of the Market Vectors Junior Gold Miners Index (the “Junior Gold Miners Index”). For a further description of the Junior Gold Miners Index, see “Junior Gold Miners Index.” The objective of (SGOL) the newly listed shares is to reflect the performance of the price of Gold bullion, less the Trust’s operating expenses. The Trust is open ended and is designed for investors who want a cost-effective(1) and convenient(2) way to invest in Gold as well as diversify their Gold holdings. The investment (UGL) will seek to replicate, net of expenses, twice the performance of gold bullion as measured by the U.S. Dollar p.m. fixing price for delivery in London. The fund normally invests assets in financial instruments with economic characteristics twice the return of the index. It may employ leveraged investment techniques in seeking its investment objective. The investment (DGL) seeks to track the price and yield performance, before fees and expenses, of the Deutsche Bank Liquid Commodity Index – Optimum Yield Gold Excess Return. The index is a rules-based index composed of futures contracts on gold and is intended to reflect the performance of gold. The investment (DGP) seeks to replicate, net of expenses, twice the daily performance of the Deutsche Bank Liquid Commodity index – Optimum Yield Gold Excess Return. The index is intended to reflect changes in the market value of certain gold futures contracts and is comprised of a single unfunded gold futures contract. The objective (IAU) of the trust is for the value of its shares to reflect, at any given time, the price of gold owned by the trust at that time, less the trust’s expenses and liabilities. The trust is not actively managed. It receives gold deposited with it in exchange for the creation of baskets of iShares, sells gold as necessary to cover the trust’s liabilities, and delivers gold in exchange for baskets of iShares surrendered to it for redemption. The trust is not an investment company registered under the Investment Company Act of 1940 or a commodity pool for purposes of the Commodity Exchange Act. SHORT: The investment (DZZ) seeks to replicate, net of expenses, twice the inverse of the daily performance of the Deutsche Bank Liquid Commodity index – Optimum Yield Gold Excess Return. The index is intended to reflect changes in the market value of certain gold futures contracts and is comprised of a single unfunded gold futures contract. The investment (GLL) will seek to replicate, net of expenses, twice the inverse daily performance of gold bullion as measured by the U.S. Dollar p.m. fixing price for delivery in London. The fund normally invests assets in financial instruments with economic characteristics inverse to the index. It may employ leveraged investment techniques in seeking its investment objective. Related posts:A glance at 50 of the most in-demand listed gold stocks, busy running away from the rest of the global investment universe. Gold ETFs Are In Jeopardy As The Price Of Gold Could Retrace Below $1000 Gold ETF’s Hold Steady As Gold Finds Support (GLD, IAU, DGL) Copyright 2010 ETFDAILYNEWS.COM The copying, republication or redistribution of ETFDailyNews Content, including by framing or similar means, is expressly prohibited without the prior written consent of ETFDailyNews."
2010-03-25,Does Investing In The Platinum ETF Make More Sense Than A Gold ETF?,"“Gold might have history on its side, but when it comes to investing in precious metals platinum arguably makes more sense. Platinum is rarer, dearer and just as pretty. What’s more, unlike gold, it has an important industrial use in automotive catalytic converters and LCD TV screens. If that weren’t enough to recommend the white metal, the launch of new exchange-traded funds makes platinum easier than ever to buy and sell,” Christopher Helman Reports From Forbes. Helman goes on to say, “How does platinum compare to gold as an investment? It tends to trail its yellow sister when times are bad but outperform when industrial demand recovers. That’s been the case in the past three months, as platinum prices have outpaced gold’s by roughly 10 percentage points. These days, an ounce of platinum at $1,600 buys roughly 1.4 ounces of gold. That’s more than the average of 1.2 ounces last year, according to Bloomberg. Back in May 2008, an ounce of platinum bought 2.4 ounces of gold” “The ETF Securities Physical Platinum Shares (PPLT) fund is similar to the popular gold bullion SPDR Gold Shares ETF (GLD) in that it buys and holds raw bullion (safeguarded by JP Morgan Chase (JPM)). Its shares track platinum’s spot price. You’ll incur lower transaction and storage fees in holding the ETF (annual expenses: 0.6%) than in holding and storing your own bullion bars,” Helman Reports. See more details to Helman’s story: HERE Platinum does have some appeal to it for different reasons but, the SPDR Gold Shares ETF is the second biggest ETF in the world for a reason. There are also many other ways to play gold through ETFs. We have listed some other options investors may be interested in looking at below: LONG: The investment (GLD) seeks to replicate the performance, net of expenses, of the price of gold bullion. The trust holds gold, and is expected to issue baskets in exchange for deposits of gold, and to distribute gold in connection with redemption of baskets. The gold held by the trust will only be sold on an as-needed basis to pay trust expenses, in the event the trust terminates and liquidates its assets, or as otherwise required by law or regulation. The investment (GDX) seeks to replicate as closely as possible, before fees and expenses, the price and yield performance of the AMEX Gold Miners index. The fund generally normally invests at least 80% of its total assets in common stocks and American depositary receipts (ADRs) of companies involved in the gold mining industry. The fund is nondiversified. The Funds (GDXJ) investment objective is to replicate as closely as possible, before fees and expenses, the price and yield performance of the Market Vectors Junior Gold Miners Index (the “Junior Gold Miners Index”). For a further description of the Junior Gold Miners Index, see “Junior Gold Miners Index.” The objective of (SGOL) the newly listed shares is to reflect the performance of the price of Gold bullion, less the Trust’s operating expenses. The Trust is open ended and is designed for investors who want a cost-effective(1) and convenient(2) way to invest in Gold as well as diversify their Gold holdings. The investment (UGL) will seek to replicate, net of expenses, twice the performance of gold bullion as measured by the U.S. Dollar p.m. fixing price for delivery in London. The fund normally invests assets in financial instruments with economic characteristics twice the return of the index. It may employ leveraged investment techniques in seeking its investment objective. The investment (DGL) seeks to track the price and yield performance, before fees and expenses, of the Deutsche Bank Liquid Commodity Index – Optimum Yield Gold Excess Return. The index is a rules-based index composed of futures contracts on gold and is intended to reflect the performance of gold. The investment (DGP) seeks to replicate, net of expenses, twice the daily performance of the Deutsche Bank Liquid Commodity index – Optimum Yield Gold Excess Return. The index is intended to reflect changes in the market value of certain gold futures contracts and is comprised of a single unfunded gold futures contract. The objective (IAU) of the trust is for the value of its shares to reflect, at any given time, the price of gold owned by the trust at that time, less the trust’s expenses and liabilities. The trust is not actively managed. It receives gold deposited with it in exchange for the creation of baskets of iShares, sells gold as necessary to cover the trust’s liabilities, and delivers gold in exchange for baskets of iShares surrendered to it for redemption. The trust is not an investment company registered under the Investment Company Act of 1940 or a commodity pool for purposes of the Commodity Exchange Act. SHORT: The investment (DZZ) seeks to replicate, net of expenses, twice the inverse of the daily performance of the Deutsche Bank Liquid Commodity index – Optimum Yield Gold Excess Return. The index is intended to reflect changes in the market value of certain gold futures contracts and is comprised of a single unfunded gold futures contract. The investment (GLL) will seek to replicate, net of expenses, twice the inverse daily performance of gold bullion as measured by the U.S. Dollar p.m. fixing price for delivery in London. The fund normally invests assets in financial instruments with economic characteristics inverse to the index. It may employ leveraged investment techniques in seeking its investment objective. Related posts:Investors Are Turning To The Platinum ETF Instead Of GOLD Grab Your Share Of A Gold ETF As GOLD May Reach $1500 In 2010 Is The SPDR Gold ETF The Reason Behind The Massive Rally In Gold? Copyright 2010 ETFDAILYNEWS.COM The copying, republication or redistribution of ETFDailyNews Content, including by framing or similar means, is expressly prohibited without the prior written consent of ETFDailyNews."
