created,title,body
2011-03-17,Global X Distills A Pure Gold Miners ETF,"Global X on Tuesday (3/15/11) rolled out a new ETF designed to target companies producing gold and only gold. Global X Pure Gold Miners ETF (GGGG) seeks to track an index that limits inclusion to companies that generate the vast majority of their business from gold mining. The underlying Solactive Global Pure Gold Miners Index restricts new index components to those with at least 95% of the company's revenues generated from gold mining. To remain in the index, that proportion must remain above 90%. Additionally, constituents are weighted proportionally on free float market capitalization with the largest positions capped at 4.75% each. The resulting country breakdown for the fund currently has Canada at 41.3%, South Africa 15.4%, U.S. 11.2%, Australia 9.1%, U.K. 6.4%, Jersey 4.8%, Russia 4.8%, China 4.1%, and Turkey 3.0%. GGGG has an expense ratio of 0.59%, and the fund has 30 holdings in all. The nine stocks capped at 4.75% during the last index rebalancing were Kinross Gold Corp (KGC), Anglogold Ashanti ADR (AU), Gold Fields Ltd ADR (GFI), Polyus Gold ADR (OPYGY), Eldorado Gold Corp (EGO), Randgold Resources Ltd-ADR (GOLD), Osisko Mining Corp (OSKFF), Petropavlovsk Plc, and Centerra Gold Inc. GGGG will be in competition with both Market Vectors Gold Miners (GDX) and Market Vectors Junior Gold Miners (GDXJ), as GGGG's holdings are found in both. However, due to its “pure” play philosophy, GGGG excludes many familiar names that don't meet that description including Barrick Gold (ABX), Newmont Mining (NEM), Buenaventura Mining Company (BVN), and Yamana Gold (AUY). Additional information is located on the summary page, in the fact sheet (pdf), and in the prospectus (pdf). Disclosure covering writer, editor, and publisher: No positions in any of the securities mentioned. No positions in any of the companies or ETF sponsors mentioned. No income, revenue, or other compensation (either directly or indirectly) received from, or on behalf of, any of the companies or ETF sponsors mentioned."
2011-04-02,ETF Showdown: This One's For Goldfinger,"Since the series debuted in 1962, 22 official James Bond movies have been produced. Did you know that three of the titles mention gold? Of those three, Goldfinger is probably still the most-well known and that film, the third in the 007 series, is still widely regarded as one of the best in the series. Basically, the villain, Auric Goldfinger, wants to loot Fort Knox for its gold. Fast-forward almost 50 years since the movie was made and plenty of conspiracy theorists openly say there isn't even any gold in Fort Knox. Maybe Auric Goldfinger would need to consider some ETFs if he was around today. So with that, this week's ETF Showdown compares two equity-based gold ETFs that might just appeal to Goldfinger himself. When discussing gold ETFs that track equities rather than featuring physical holdings of the commodity itself, that means we have to talk about gold miners and that leads us to the Market Vectors Gold Miners ETF (NYSE: GDX), the big kahuna of equity ETFs with gold exposure. GDX is almost five years-old and has accumulated almost $660 million in assets under management, highlighting its dominance in this genre. But competition may be here in the form of the newly minted Global X Gold Explorers ETF (NYSE: GLDX). GLDX is five months old, but has garnered $25.4 million in AUM since its debut. Gold explorers and gold miners, what's the difference? Well, the important difference to note with GDX and GLDX is the holdings. GDX has 31 holdings and GLDX has 31, but GLDX offers exposure to the more speculative side of gold stocks. Anyone that has invested in gold equities probably knows about Barrick Gold (NYSE: ABX), Goldcorp (NYSE: GG) and Newmont Mining (NYSE: NEM), all of which can be found among GDX's top-10 holdings. On the other hand, companies like NovaGold Resources (AMEX: NG), Rubicon Minerals (AMEX: RBY) and other less heralded fare make up the bulk of GLDX's holdings. Since GLDX is more a junior miner play, it is more than 83% allocated to Canada at the country level compared to about 65% for GDX. GDX trumps its newer rival when it comes to expenses with an expense ratio of 0.53% compared to 0.65% for GLDX. Even the Market Vectors Junior Gold Miners ETF (NYSE: GDXJ) features lower fees than GLDX. The bottom line is that for investors that are simply gold crazy, GDX and GLDX combined could be a potent idea because that scenario covers large caps and more speculative issues. Still, it's usually a more sound idea to keep risk to a minimum with gold stocks, so GDX is probably the better bet for the conservative trader or investor."
2011-04-05,"Benzinga's Top ETF Gainers, April 5th (NUGT, SOXL, GDXJ, JO)","Direxion Daily Gold Miners Bull 2X Shares (NYSE: NUGT) led the gainers among the ETFs on Tuesday, with an increase of 9.95%. NGUT closed at $39.89, and it had a volume of 116K traded shares. Direxion Daily Semiconductor Bull 3X Shares (NYSE: SOXL) jumped 6.52% on the strength in the semiconductor space. In the sector, Texas Instruments Incorporated (NYSE: TXN) jumped 1.70%, and Broadcom Corporation (NASDAQ: BRCM) gained 0.97%. National Semiconductor Corporation (NYSE: NSM) spiked 71% on the news of the acquisition by Texas Instruments (TXN). Market Vectors Junior Gold Miners ETF (NYSE: GDXJ) traded 5.74% higher as Allied Nevada Gold Corp. (AMEX: ANV) spiked 7.01%, and Silvercorp Metals Inc. (USA) (NYSE: SVM) gained 5.09%. iPath Dow Jones-UBS Coffee Subindex Total Return ETN (NYSE: JO) added 5.43% today as coffee futures traded more than 4% higher. JO broke its two-day losing streak today."
2011-04-06,"ETFs To Watch April 6, 2011 (SLV, XRT, SCIN, HAO)","Here is the ETF Professor's ETF Watch List for Wednesday April 6, 2011. Use the Market Vectors Agribusiness ETF (NYSE: MOO) as an earnings play. Perhaps the best gold play: Market Vectors Junior Gold Miners ETF (NYSE: GDXJ). The iShares Silver Trust (NSYE: SLV) is obviously worth a look. The SPDR S&P Retail ETF (NYSE: XRT) is also worth a look. Emerging markets plays of the day: EGShares India SmallCap ETF (NYSE: SCIN), Guggenheim China SmallCap ETF (NYSE: HAO) and iShares MSCI Thailand Investable Market Index Fund (NYSE: THD). Forex play of the day: CurrencyShares Australian Dollar Trust (NYSE: FXA). Bond play of the day: Direxion Daily 20+ Yr Treasury Bear 3X Shares (NYSE: TMV)."
2011-04-12,"ETFs To Watch April 13, 2011 (ALD, FAZ, XLP, EEV)","Here is the ETF Professor's ETF Watch List for Wednesday April 13, 2011. Direxion Daily Financial Bear 3X Shares (NYSE: FAZ) and the ProShares UltraShort Financials (NYSE: SKF) as earnings plays. For those willing to bet on a rebound in gold, try the ProShares Ultra Gold (NYSE: UGL) and the Market Vectors Junior Gold Miners ETF (NYSE: GDXJ). Play a little defense with the Consumer Staples Select Sector SPDR (NYSE: XLP) and the PowerShares Dynamic Food & Beverage ETF (NYSE: PBJ). Emerging markets plays of the day: Direxion Daily China Bear 3X Shares (NYSE: CZI), ProShares UltraShort MSCI Emerging Markets (NYSE: EEV) and the Market Vectors Russia ETF (NYSE: RSX). Forex play of the day: CurrencyShares Japanese Yen Trust (NYSE: FXY). Bond play of the day: WisdomTree Asia Local Debt ETF (NYSE: ALD)."
2011-04-14,"Benzinga's Top ETF Gainers, April 14th (AGQ, DRN, GAZ, GDXJ)","ProShares Ultra Silver (ETF) (NYSE: AGQ) traded 7.59% higher on Thursday as silver jumped above $42. AGQ closed at $278.64, and that is its 52-week high. In the after hours AGQ jumped 0.72%. Direxion Daily Real Estate Bull 3X (ETF) (NYSE: DRN) gained 4.35% and closed at $65.56. In the real estate space, Simon Property Group, Inc (NYSE: SPG) jumped 2.28%, and Vornado Realty Trust (NYSE: VNO) added 2.03%. iPath Dow Jones-UBS Natural Gas Subindex Total Return ETN (NYSE: GAZ) traded higher today, along with natural gas futures. GAZ jumped 3.11% in the regular session, and it added 0.70% in the after hours. Market Vectors Junior Gold Miners ETF (NYSE: GDXJ) gained 2.91% as Allied Nevada Gold Corp. (AMEX: ANV) spiked 3.96% in the regular trading session. In the after hours it gained additional 1.60%."
2011-04-15,"ETFs To Watch April 15, 2011 (FDN, EDZ, DRN, TBT)","Here is the ETF Professor's ETF Watch List for Friday April 15, 2011. For Google (Nasdaq: GOOG) earnings: First Trust Dow Jones Internet Index Fund (NYSE: FDN) and the Select Sector Technology SPDR (NYSE: XLK). For Bank of America (NYSE: BAC) earnings: Financial Select Sector SPDR (NYSE: SPDR) and the Direxion Daily Financial Bear 3X Shares (NYSE: FAZ). The Market Vectors Junior Gold Miners ETF (NYSE: GDXJ) had a solid day on Thursday. The Direxion Daily Real Estate Bull 3X Shares (NYSE: DRN) was up more than 4% on Thursday. Emerging markets plays of the day: Direxion Daily Emerging Markes Bear 3X Shares (NYSE: EDZ), iShares FTSE China 25 Index Fund (NYSE: FXI) and the Market Vectors Vietnam ETF (NYSE: VNM). Forex play of the day: CurrencyShares Swiss Franc Trust (NYSE: FXF). Bond play of the day: ProShares UltraShort 20+ Year Treasury (NYSE: TBT)."
2011-04-15,A Look Ahead: Next Week's ETFs To Watch,"A week of substantial headline risk be it at the hands of Japan, bearish views on oil or disappointing earnings results has drawn to a close and perhaps the best thing that can be said is Hey, at least stocks closed higher on Friday. Still, Friday's effort will do little to put a dent in weekly losses for the major U.S. indexes. With the earnings spigot wide open next week, we've got a great assortment of ETFs that should be in play so let's have a look at next week's ETFs to watch. 1) Market Vectors Coal ETF (NYSE: KOL): Two of KOL's to-be-acquired constituents, Bucyrus (Nasdaq: BUCY) and Massey Energy (NYSE: MEE) report on Monday. Peabody Energy (NYSE: BTU), the largest U.S. coal producer, follows on Tuesday so next week promises to be busy for KOL. 2) ProShares Short Dow30 (NYSE: DOG) or the SPDR Dow Jones Industrial Average (NYSE: DIA): Pick your poison here. Eight Dow stocks report next week. 3) SPDR KBW Regional Banking (NYSE: KRE) and the Financial Select Sector SPDR (NYSE: XLF): Again, have it your way. There isn't a day next week when at least one marquee national or super-regional banking name doesn't step into the earnings confessional. 4) Oil Services HOLDRs (AMEX: OIH): Yes, this is an earnings play with Halliburton (NYSE: HAL) reporting on Monday and Diamond Offshore (NYSE: DO), Weatherford International (NYSE: WFT) and Schlumberger (NYSE: SLB) reporting on Thursday, but OIH is also worth watching because options traders have been making some bearish bets on the fund in recent days and momentum could be waning here. 5) Market Vectors Junior Gold Miners ETF (NYSE: GDXJ): With gold jumping to another record on Friday, GDXJ's finish to the week was disappointing. We don't want to sound any alarms here, but this ETF really needs to break through $42 or risk forming an ominous double top."
2011-04-15,"CEOWORLD Daily Business Roundup- China, GOOG, ZIP, BAC, MAT, HAS, GPC, KNL, SCHW, JPM, WFC…","The world's largest electronics retailer by sales Best Buy Co. (BBY) plan to grow its online and mobile businesses while scaling back its “big box” retail space as part of a broader strategy to combat declining sales and rising competition. China's economy grew at a slightly slower rate in the first quarter, as food prices continued to surge and limit the purchasing power of consumers. Chinese economy grew at a pace of 9.7% in the first three months of the year, the National Bureau of Statistics said Friday. Research In Motion's (RIMM) Playbook tablet received poor reviews. It cannot send email unless tethered to a BlackBerry. A Groupon IPO could set the firm's value at $20 billion. (Reuters) Google Inc. (GOOG) increased gross revenue 27% year over year. Net income rose to $2.3 billion, ($7.04 a share) from $1.96 billion ($6.06 a share) year-over-year. Net revenues came in at $6.5 billion, beating analyst expectations for $6.3 billion. Here were some of last quarter's key metrics reported outside of earnings: Net cash provided by operating activities in the fourth quarter of 2010 totaled $3.53 billion. It ended the quarter with $35.0 billion in cash and equivalents. Google listed its total headcount was 24,400 full-time employees as of December 31, 2010, up from 23,331 full-time employees as of September 30, 2010. Google Sites revenues from its own websites generated 67% of revenues at $5.67 billion, a 28% increase over fourth quarter 2009 revenues of $4.42 billion. Google Network revenues from partner sites and AdSense programs rose 22% to $2.50 billion, which is 30% of total revenues. International revenues were 52% of total revenues at $4.38 billion, compared to 52% in the third quarter of 2010 and 53% in the fourth quarter of 2009. Ratings agency Moody's cut Ireland's credit score Friday to Baa3 — one level above junk-bond status — and warned the nation could struggle to cut its deficit because of weaker-than-expected economic growth. The outlook on these ratings remains negative, as Moody's believes the Government's financial strength could decline further if economic growth were to be weaker than expected. Telefonos de Mexico SA de CV (TMX) at $18.38 pays close to a 6% yield and ADRs have traded in a range of $13.00 to $18.94 in the last 52-weeks. The Mexican telecom operator is one of the highest yields in Latin America. Goldman Sachs Group (NYSE: GS) of selling weak financial securities and betting against the interests of its clients. Genuine Parts Co. (GPC) is forecast to post earnings of 75 cents a share in the first quarter. Knoll Inc. (KNL) is likely to report a first-quarter profit of 20 cents a share. Astrazeneca PLC (AZN) pays twice a year and we had to split the past two dividends as a result. At $49.02, the drug giant's implied yield is close to 5.2% and these ADRs have traded in a range of $40.30 to $53.53 in the last 52-weeks. Shares of Zipcar Inc. (ZIP) soared 56 percent on its first day of trading yesterday one of the best IPO showings this year. The company's stock opened at $30 a share on the Nasdaq, up 66.7% from its initial public offering price of $18. It sold 9.7 million shares, 1.4 million more than expected, at a price above its anticipated $14 to $16 range. It was changing hands recently at $29.72, up 65%. Bank of America Corporation (BAC) is due to report earnings on Friday morning, is expected to report first-quarter earnings of 28 cents a share, according to analysts surveyed by FactSet Research. Late Thursday, the company said it's cutting 1,500 jobs in its mortgage-origination business. Mattel (MAT) reported a first-quarter net profit of 5 cents a share, ahead of the consensus forecast of 4 cents, as sales rose 8% to $951.9 million. The NYSE (NYX) may offer a dividend to close and M&A deal with Deutsche Boerse. Nokia Corporation (NOK) pays only an annual yield and it has proposed a 0.40 euro per share dividend for its annual meeting next month in May. This gives the currency risk even more room for error, but if we just keep it static then the payout would come to close to 6.4% since its $8.66 ADR price is so low against a 52-week range of $7.73 to $15.47. Maybe this is the only good thing happening at Nokia. Hasbro Inc. (HAS) reported adjusted earnings of 12 cents a share for the quarter, short of Wall Street's consensus estimate of 17 cents, and it shares lost 3% on the session. Warner Music (WMG) plans to sell itself intact. American Air (NYSE: AMR) sued Orbitz over anti-competitive practices. Charles Schwab Corp. (SCHW) is estimated to report a profit of 19 cents a share for the first quarter. Wells Fargo (WFC) has generated lots of income from its mortgage-service rights, or MSR, in recent years. But in the fourth quarter of 2010, Wells reduced the value of its MSR by $143 million because of higher estimated future servicing and foreclosure costs. JPMorgan Chase (JPM) earnings soared 67 percent in the first quarter on higher fees from investment banking and as fewer customers fell behind on their credit card bills. The bank recorded more losses from its mortgage business, and CEO Jamie Dimon said he didn't expect those problems to go away soon. Comcast (CMCSA) customers in about 200 Bay State cities and towns now have access to super-fast Internet connections designed for high-definition and 3-D aficionados. Comcast has finally announced the initial availability of its Extreme 105 Xfinity Internet service, which is currently available to 40 million homes in major markets such as Baltimore, Boston, Chicago, Denver, Indianapolis, Miami, Philadelphia, Portland, Salt Lake City, San Francisco, and Washington DC. GlaxoSmithKline (GSK) plans to sell 19 of its consumer-health brands, including the controversial Alli weight-loss drug and Goody's and BC, two headache powders invented in North Carolina. The U.K.'s largest drugmaker said it wants its consumer health unit to focus on “fast-growing” brands such as Sensodyne toothpaste and the pain reliever Panadol. Glaxo hired Goldman Sachs Group Inc. (GS) to manage the sale, which was announced Feb. 3, a person with direct knowledge of the process said March 24. It could reap as much as 2 billion pounds ($3.3 billion), a second person said at the time. Market Vectors Gold Miners ETF( GDX) up about 1.2% to $61.57, in a 52-week range of $45.70-$64.62, and the Market Vectors Junior Gold Miners ETF (GDXJ) up nearly 2.5%, to $40.83, in a 52-week range of $24.25-$44.86. The Global X Silver Miners ETF (SIL) is up about 0.4%, to $29.01, in a 52-week range of $12.90-$31.34. CVS Caremark Corporation (CVS) said an increasing use of generic drugs by its customers helped keep costs in check last year as the industry copes with pricing pressures and sweeping changes in U.S. health-care policy. CVS Caremark Corp. (CVS), is being investigated for antitrust behavior by attorneys from 24 states and the Federal Trade Commission, is coming under increasing pressure to split up four years after CVS and Caremark merged, the New York Times reported. BP plc (BP) Extends Arctic Deal said in an official statement that it has agreed to extend the deadline for the $16 billion deal for the exploration in Russia. “BP has agreed with Rosneft to extend the deadline for completing the share-swap agreement—previously announced on 14 January—to 16 May” the statement said. MGM Resorts International (MGM) announced yesterday that long-time director Kirk Kerkorian would leave the company's board and transit into an advisory role. The board of directors of MGM Resorts International voted unanimously to recognize Mr Kerkorian with the distinction of director emeritus. The SPDR Gold Trust ETF (GLD) was up about 1.2%, at $143.59, at the top of its 52-week range of $110.54-$143.84. The iShares Silver Trust (SLV) was up nearly 3%, at $40.72, after setting a new 52-week high of $40.74 earlier in the day. First Solar, Inc. (FSLR), a market cap north of $12 billion, president of operations, Bruce Sohn, will leave. First Solar shares are down more than $4, or more than 2.8%, to $140.60 today. That means Mr. Sohn's exit has chipped a mere $360.1 million off of First Solar's market value. CEOWORLD Daily Business Roundup- JNJ, CHK, AMD, T, AXP, AAPL, INTC, JPM, GOOG, LLY, CSCO… CEOWORLD Daily Business Roundup- IBM, INTC, AAPL, VMW, MMI, RIMM, NDAQ, AES, DPL, NRG, TM, S, GE…Top stock picks with slam-dunk potential- AAPL, ONP, AUO, IMAX, GLD and TLVTBank of America Posts loss After Lender Repays Bailout FundsCEOWORLD Daily Business and Tech Roundup- AAPL, BP, RIG, VZ, RIMM, NOK, AIG, BRK.B, BA, GOOG, WFC…CEOWORLD Top Commodities Stocks- DE, MON, POT, PCL, LPX, WY, GLD, SLV and MASTop 10 Best Stock Picks for 2011- MSFT, OTT, CEO, EVR, CTSH, ZION, ZLCS, BAC, BAC and MSPDJP Morgan to reveal billions in bonuses as profits riseTop Best Stocks to buy for your Kids in 2010CEOWORLD Daily Business Roundup- BP, GS, GM, RIMM, YHOO, TXN, IBM, YHOO, C, INTC, WMT, AAPL…"
2011-04-18,"Market Decline Equals A Chance To Add Gold Miners (GDX, GDXJ, GLDX, PSAU)","Even though physical gold prices have risen in the face of the today's S&P U.S. outlook, the companies that mine the metal have fallen hard. This gives investors a perfect opportunity to add the sector. Due to the miners' production cost structure (which comes with fixed expenses), these companies can act as a leveraged plays on gold prices. Essentially, a 1% increase in the price of gold will often equal a greater than 1% increase in a miners' operating income. This gives the gold miners a unique risk/return profile relative to physical gold. While the sector isn't known for its huge dividends, ever-increasing gold prices could change that. With gold hitting record highs, many firms are seeing operating margins surge for each ounce of gold produced. Many of the top producers have cash cost in the range of $400 to $600 per ounce. As the sector continues its trend of increased profitability, investors can expect more dividend increases. The Market Vectors Gold Miners ETF (NYSE: GDX), Market Vectors Junior Gold Miners ETF (NASDAQ: GDXJ) and Global X Gold Explorers ETF (NASDAQ: GLDX) all focus on different areas of the gold mining spectrum and could be used as plays for adding exposure. Investors may also want to consider the PowerShares Global Gold & Precious Metals (NASDAQ: PSAU) as well. Disclosure: Author is Long GDXJ and IAU"
2011-04-27,"Benzinga's Top ETF Gainers, April 27th (AGQ, SIL, AGA, GDXJ)","ProShares Ultra Silver (ETF) (NYSE: AGQ) led the gainers among the ETFs on Wednesday, with an increase in price of 13.60%. AGQ closed at $361.75, and it had a volume of 4.33M traded shares. Global X Silver Miners (NYSE: SIL) gained 5.40% today as Silver Wheaton Corp. (USA) (NYSE: SLW) spiked 7.25%, and Pan American Silver Corp. (USA) (NASDAQ: PAAS) gained 3.93%. PowerShares DB Agriculture Double Short ETN (NYSE: AGA) jumped 4.30% today as wheat futures traded sharply lower. AGA closed at $16.72, and it had a volume of 29K traded shares. Market Vectors Junior Gold Miners ETF (NYSE: GDXJ) traded 3.69% higher today, and closed at $41.63. Allied Nevada Gold Corp. (AMEX: ANV) is a component of the Market Vectors Junior Gold Miners Index, and it jumped 4.94% today."
2011-05-05,Van Eck Lowers Expenses On Five ETFs,"Van Eck, the parent company of Market Vectors, the sixth-largest U.S. ETF issuer, announced today that it is lowering the expense ratios on five of its ETFs effective May 1. The ETFs that will see lower fees are the Market Vectors Africa Index ETF (NYSE: AFK), the Market Vectors Brazil Small-Cap ETF (NYSE: BRF), the Market Vectors Junior Gold Miners ETF (NYSE: GDXJ), the Market Vectors RVE Hard Assets Producers ETF (NYSE: HAP) and the Market Vectors Uranium+Nuclear Energy ETF (NYSE: NLR). AFK's fees will be reduced to 0.78% from 0.83% while BRF's fees go to 0.62% from 0.65%. GDXJ goes to 0.56% from 0.59%. HAP goes to 0.59% from 0.65% and NLR will see its fees pared to 0.6% from 0.62%. The new fees will be locked in until May 1, 2012. “We've been very pleased with the growth experienced by these funds over the course of the past year and we are happy to reduce fees for shareholders,” said Ed Lopez, marketing director at Van Eck Global. Earlier this year, Van Eck pared the expenses on the Market Vectors Indonesia ETF (NYSE: IDX) and the Market Vectors Poland ETF (NYSE: PLND). Van Eck currently has 33 ETFs listed in the U.S. and $23 billion in assets under management."
