created,title,body
2022-09-16,"Benzinga's Top Ratings Upgrades, Downgrades For September 16, 2022","Upgrades Morgan Stanley upgraded the previous rating for Alcoa Corp (NYSE:AA) from Equal-Weight to Overweight. Alcoa earned $2.67 in the second quarter, compared to $1.49 in the year-ago quarter. The current stock performance of Alcoa shows a 52-week-high of $98.09 and a 52-week-low of $39.56. Moreover, at the end of the last trading period, the closing price was at $43.14. For Southern Copper Corp (NYSE:SCCO), Morgan Stanley upgraded the previous rating of Underweight to Equal-Weight. For the second quarter, Southern Copper had an EPS of $0.56, compared to year-ago quarter EPS of $1.21. At the moment, the stock has a 52-week-high of $79.31 and a 52-week-low of $44.31. Southern Copper closed at $46.76 at the end of the last trading period. According to Morgan Stanley, the prior rating for Teck Resources Ltd (NYSE:TECK) was changed from Equal-Weight to Overweight. In the second quarter, Teck Resources showed an EPS of $2.55, compared to $0.51 from the year-ago quarter. The stock has a 52-week-high of $45.90 and a 52-week-low of $24.72. At the end of the last trading period, Teck Resources closed at $32.35. Cowen & Co. upgraded the previous rating for Shoals Technologies Group Inc (NASDAQ:SHLS) from Market Perform to Outperform. In the second quarter, Shoals Technologies Gr showed an EPS of $0.07, compared to $0.09 from the year-ago quarter. The current stock performance of Shoals Technologies Gr shows a 52-week-high of $28.47 and a 52-week-low of $9.58. Moreover, at the end of the last trading period, the closing price was at $24.78. See all analyst ratings upgrades. Downgrades For Vermilion Energy Inc (NYSE:VET), Scotiabank downgraded the previous rating of Sector Outperform to Sector Perform. Vermilion Energy earned $1.72 in the second quarter, compared to $2.27 in the year-ago quarter. The current stock performance of Vermilion Energy shows a 52-week-high of $30.17 and a 52-week-low of $12.52. Moreover, at the end of the last trading period, the closing price was at $24.88. For DXC Technology Co (NYSE:DXC), Susquehanna downgraded the previous rating of Positive to Neutral. DXC Technology earned $0.75 in the first quarter, compared to $0.84 in the year-ago quarter. The stock has a 52-week-high of $39.65 and a 52-week-low of $23.99. At the end of the last trading period, DXC Technology closed at $27.47. According to Susquehanna, the prior rating for Infosys Ltd (NYSE:INFY) was changed from Positive to Neutral. Infosys earned $0.16 in the first quarter, compared to $0.17 in the year-ago quarter. The stock has a 52-week-high of $26.39 and a 52-week-low of $17.51. At the end of the last trading period, Infosys closed at $17.79. For FedEx Corp (NYSE:FDX), Loop Capital downgraded the previous rating of Buy to Hold. In the fourth quarter, FedEx showed an EPS of $6.87, compared to $5.01 from the year-ago quarter. At the moment, the stock has a 52-week-high of $266.79 and a 52-week-low of $192.82. FedEx closed at $204.87 at the end of the last trading period. According to Barclays, the prior rating for Adobe Inc (NASDAQ:ADBE) was changed from Overweight to Equal-Weight. In the third quarter, Adobe showed an EPS of $3.40, compared to $3.11 from the year-ago quarter. At the moment, the stock has a 52-week-high of $575.00 and a 52-week-low of $305.00. Adobe closed at $309.13 at the end of the last trading period. Wells Fargo downgraded the previous rating for Arrow Electronics Inc (NYSE:ARW) from Equal-Weight to Underweight. Arrow Electronics earned $5.78 in the second quarter, compared to $3.34 in the year-ago quarter. The stock has a 52-week-high of $137.95 and a 52-week-low of $98.39. At the end of the last trading period, Arrow Electronics closed at $99.81. According to Wells Fargo, the prior rating for Avnet Inc (NASDAQ:AVT) was changed from Equal-Weight to Underweight. For the fourth quarter, Avnet had an EPS of $2.07, compared to year-ago quarter EPS of $1.12. The stock has a 52-week-high of $50.19 and a 52-week-low of $36.66. At the end of the last trading period, Avnet closed at $40.11. B of A Securities downgraded the previous rating for Adobe Inc (NASDAQ:ADBE) from Buy to Neutral. In the third quarter, Adobe showed an EPS of $3.40, compared to $3.11 from the year-ago quarter. The stock has a 52-week-high of $575.00 and a 52-week-low of $305.00. At the end of the last trading period, Adobe closed at $309.13. For International Paper Co (NYSE:IP), Jefferies downgraded the previous rating of Hold to Underperform. International Paper earned $1.24 in the second quarter, compared to $1.06 in the year-ago quarter. At the moment, the stock has a 52-week-high of $50.23 and a 52-week-low of $39.37. International Paper closed at $39.68 at the end of the last trading period. Baird downgraded the previous rating for Adobe Inc (NASDAQ:ADBE) from Outperform to Neutral. In the third quarter, Adobe showed an EPS of $3.40, compared to $3.11 from the year-ago quarter. At the moment, the stock has a 52-week-high of $575.00 and a 52-week-low of $305.00. Adobe closed at $309.13 at the end of the last trading period. For FedEx Corp (NYSE:FDX), JP Morgan downgraded the previous rating of Overweight to Neutral. For the fourth quarter, FedEx had an EPS of $6.87, compared to year-ago quarter EPS of $5.01. The current stock performance of FedEx shows a 52-week-high of $266.79 and a 52-week-low of $192.82. Moreover, at the end of the last trading period, the closing price was at $204.87. Keybanc downgraded the previous rating for FedEx Corp (NYSE:FDX) from Overweight to Sector Weight. FedEx earned $6.87 in the fourth quarter, compared to $5.01 in the year-ago quarter. The current stock performance of FedEx shows a 52-week-high of $266.79 and a 52-week-low of $192.82. Moreover, at the end of the last trading period, the closing price was at $204.87. See all analyst ratings downgrades. Initiations Stifel initiated coverage on PureCycle Technologies Inc (NASDAQ:PCT) with a Buy rating. The price target for PureCycle Technologies is set to $15.00. PureCycle Technologies earned $0.09 in the second quarter, compared to $0.13 in the year-ago quarter. At the moment, the stock has a 52-week-high of $10.95 and a 52-week-low of $4.94. PureCycle Technologies closed at $9.90 at the end of the last trading period. With a Buy rating, Needham initiated coverage on Snowflake Inc (NYSE:SNOW). The price target seems to have been set at $240.00 for Snowflake. In the second quarter, Snowflake showed an EPS of $0.01, compared to $0.04 from the year-ago quarter. At the moment, the stock has a 52-week-high of $344.00 and a 52-week-low of $110.27. Snowflake closed at $196.49 at the end of the last trading period. For Allscripts Healthcare Solutions Inc (NASDAQ:MDRX), Keybanc initiated coverage, by setting the current rating at Sector Weight. Allscripts Healthcare earned $0.18 in the second quarter, compared to $0.23 in the year-ago quarter. The current stock performance of Allscripts Healthcare shows a 52-week-high of $23.25 and a 52-week-low of $13.99. Moreover, at the end of the last trading period, the closing price was at $16.67. With an Overweight rating, Keybanc initiated coverage on Benefitfocus Inc (NASDAQ:BNFT). The price target seems to have been set at $10.00 for Benefitfocus. Benefitfocus earned $0.10 in the second quarter, compared to $0.18 in the year-ago quarter. The stock has a 52-week-high of $13.05 and a 52-week-low of $6.24. At the end of the last trading period, Benefitfocus closed at $6.62. For Doximity Inc (NYSE:DOCS), Keybanc initiated coverage, by setting the current rating at Sector Weight. For the first quarter, Doximity had an EPS of $0.14, compared to year-ago quarter EPS of $0.11. The stock has a 52-week-high of $64.95 and a 52-week-low of $27.06. At the end of the last trading period, Doximity closed at $32.65. For GoodRx Holdings Inc (NASDAQ:GDRX), Keybanc initiated coverage, by setting the current rating at Sector Weight. GoodRx Holdings earned $0.06 in the second quarter, compared to $0.08 in the year-ago quarter. The stock has a 52-week-high of $33.15 and a 52-week-low of $5.58. At the end of the last trading period, GoodRx Holdings closed at $6.51. Keybanc initiated coverage on Omnicell Inc (NASDAQ:OMCL) with an Overweight rating. The price target for Omnicell is set to $130.00. For the second quarter, Omnicell had an EPS of $0.84, compared to year-ago quarter EPS of $0.97. The stock has a 52-week-high of $182.77 and a 52-week-low of $95.43. At the end of the last trading period, Omnicell closed at $95.76. Keybanc initiated coverage on Phreesia Inc (NYSE:PHR) with an Overweight rating. The price target for Phreesia is set to $40.00. In the second quarter, Phreesia showed an EPS of $0.89, compared to $0.48 from the year-ago quarter. The current stock performance of Phreesia shows a 52-week-high of $43.47 and a 52-week-low of $13.19. Moreover, at the end of the last trading period, the closing price was at $28.72. With an Overweight rating, Keybanc initiated coverage on Recursion Pharmaceuticals Inc (NASDAQ:RXRX). The price target seems to have been set at $20.00 for Recursion Pharmaceuticals. In the second quarter, Recursion Pharmaceuticals showed an EPS of $0.38, compared to $0.31 from the year-ago quarter. The current stock performance of Recursion Pharmaceuticals shows a 52-week-high of $18.23 and a 52-week-low of $4.92. Moreover, at the end of the last trading period, the closing price was at $13.11. For Teladoc Health Inc (NYSE:TDOC), Keybanc initiated coverage, by setting the current rating at Sector Weight. In the second quarter, Teladoc Health showed an EPS of $0.44, compared to $0.86 from the year-ago quarter. At the moment, the stock has a 52-week-high of $95.71 and a 52-week-low of $27.38. Teladoc Health closed at $31.89 at the end of the last trading period. With an Overweight rating, Keybanc initiated coverage on Veeva Systems Inc (NYSE:VEEV). The price target seems to have been set at $220.00 for Veeva Sys. Veeva Sys earned $1.03 in the second quarter, compared to $0.94 in the year-ago quarter. The stock has a 52-week-high of $257.68 and a 52-week-low of $152.04. At the end of the last trading period, Veeva Sys closed at $174.83. With a Buy rating, MKM Partners initiated coverage on CyberArk Software Ltd (NASDAQ:CYBR). The price target seems to have been set at $190.00 for CyberArk Software. For the second quarter, CyberArk Software had an EPS of $0.27, compared to year-ago quarter EPS of $0.01. The stock has a 52-week-high of $180.01 and a 52-week-low of $100.35. At the end of the last trading period, CyberArk Software closed at $153.20. With a Buy rating, MKM Partners initiated coverage on CrowdStrike Holdings Inc (NASDAQ:CRWD). The price target seems to have been set at $240.00 for CrowdStrike Holdings. For the second quarter, CrowdStrike Holdings had an EPS of $0.36, compared to year-ago quarter EPS of $0.11. At the moment, the stock has a 52-week-high of $242.00 and a 52-week-low of $130.00. CrowdStrike Holdings closed at $178.86 at the end of the last trading period. MKM Partners initiated coverage on Fortinet Inc (NASDAQ:FTNT) with a Buy rating. The price target for Fortinet is set to $70.00. Fortinet earned $0.24 in the second quarter, compared to $0.19 in the year-ago quarter. At the moment, the stock has a 52-week-high of $362.12 and a 52-week-low of $47.37. Fortinet closed at $50.82 at the end of the last trading period. MKM Partners initiated coverage on Zscaler Inc (NASDAQ:ZS) with a Buy rating. The price target for Zscaler is set to $225.00. Zscaler earned $0.25 in the fourth quarter, compared to $0.14 in the year-ago quarter. At the moment, the stock has a 52-week-high of $323.55 and a 52-week-low of $125.12. Zscaler closed at $175.99 at the end of the last trading period. Truist Securities initiated coverage on Fusion Pharmaceuticals Inc (NASDAQ:FUSN) with a Buy rating. The price target for Fusion Pharmaceuticals is set to $10.00. Fusion Pharmaceuticals earned $0.44 in the second quarter, compared to $0.63 in the year-ago quarter. At the moment, the stock has a 52-week-high of $8.73 and a 52-week-low of $1.99. Fusion Pharmaceuticals closed at $3.15 at the end of the last trading period. With a Buy rating, Truist Securities initiated coverage on POINT Biopharma Global Inc (NASDAQ:PNT). The price target seems to have been set at $22.00 for POINT Biopharma Global. For the second quarter, POINT Biopharma Global had an EPS of $0.27, compared to year-ago quarter EPS of $0.15. The current stock performance of POINT Biopharma Global shows a 52-week-high of $10.98 and a 52-week-low of $5.22. Moreover, at the end of the last trading period, the closing price was at $8.44. Stifel initiated coverage on Canoo Inc (NASDAQ:GOEV) with a Buy rating. The price target for Canoo is set to $4.00. Canoo earned $0.68 in the second quarter, compared to $0.50 in the year-ago quarter. The stock has a 52-week-high of $8.24 and a 52-week-low of $1.75. At the end of the last trading period, Canoo closed at $2.80. Wedbush initiated coverage on Vigil Neuroscience Inc (NASDAQ:VIGL) with an Outperform rating. The price target for Vigil Neuroscience is set to $19.00. At the moment, the stock has a 52-week-high of $18.27 and a 52-week-low of $2.18. Vigil Neuroscience closed at $8.24 at the end of the last trading period. See all analyst ratings initiations."
2017-07-31,Mid-Morning Market Update: Markets Mostly Higher; Discovery Communications To Acquire Scripps Networks Interactive,"Following the market opening Monday, the Dow traded up 0.30 percent to 21,895.09 while the NASDAQ declined 0.15 percent to 6,365.38. The S&P also rose, gaining 0.04 percent to 2,473.05. Leading and Lagging Sectors Basic materials shares climbed by 0.37 percent in the US market on Monday. Top gainers in the sector included Cliffs Natural Resources Inc (NYSE:CLF), and Aluminum Corp. of China Limited (ADR) (NYSE:ACH). In trading on Monday, technology shares fell 0.23 percent. Meanwhile, top losers in the sector included Ceragon Networks Ltd (NASDAQ:CRNT), down 5 percent, and Formula Systems (1985) Ltd. (ADR) (NASDAQ:FORTY), down 4 percent. Top Headline Discovery Communications Inc. (NASDAQ:DISCA) announced plans to acquire Scripps Networks Interactive, Inc. (NYSE:SNI) for $14.6 billion. Discovery will pay $90 per share in cash and stock to buy Scripps. The transaction is projected to close by early 2018. Equities Trading UP Dynavax Technologies Corporation (NASDAQ:DVAX) shares shot up 72 percent to $15.95 as the company announced that the Vaccines and Related Biological Products Advisory Committee of the U.S. Food and Drug Administration voted 12-1 in support of the company’s Hepatitis B vaccine, HEPLISAV-B. RBC Capital upgraded Dynavax from Sector Perform to Outperform. Shares of CDI Corp. (NYSE:CDI) got a boost, shooting up 32 percent to $8.20 as the company agreed to be acquired by AE Industrial Partners for $8.25 per share in cash. Alliance Holdings GP, L.P. (NASDAQ:AHGP) shares were also up, gaining 14 percent to $28.90 as the company reported quarterly financial results and raised its quarterly distribution by 32.7 percent. Equities Trading DOWN Invivo Therapeutics Holdings Corp (NASDAQ:NVIV) shares dropped 26 percent to $1.83 as the company issued an update on the INSPRE study. InVivo Therapeutics has implemented a temporary enrollment halt on the trial due to patient who passed away suddenly at a rehab facility following discharge from hospital. Shares of Navigant Consulting, Inc. (NYSE:NCI) were down 15 percent to $16.78 after the company posted downbeat quarterly results. Intercept Pharmaceuticals Inc (NASDAQ:ICPT) was down, falling around 9 percent to $122.62. Intercept posted a narrower-than-expected Q2 loss and reported that its Phase 2 AESOP trial met primary endpoint of ALP reduction. Commodities In commodity news, oil traded down 0.46 percent to $49.48 while gold traded down 0.19 percent to $1,272.90. Silver traded up 0.60 percent Monday to $16.795, while copper rose 0.52 percent to $2.89. Eurozone European shares were mostly higher today. The eurozone’s STOXX 600 gained 0.30 percent, the Spanish Ibex Index rose 0.25 percent, while Italy’s FTSE MIB Index gained 0.55 percent. Meanwhile the German DAX gained 0.13 percent, and the French CAC 40 slipped 0.06 percent while U.K. shares rose 0.54 percent. Economics The Chicago PMI declined to 58.90 in July, versus prior reading of 65.70. However, economists were expecting a reading of 60.00. The pending home sales index increased 1.5 percent to 110.2 in June. However, economists projected a 0.7 percent rise in the index. The Dallas Fed manufacturing index for July is schedule for release at 10:30 a.m. ET. The Treasury is set to auction 3-and 6-month bills at 11:30 a.m. ET. Data on farm prices for June will be released at 3:00 p.m. ET."
2011-10-23,Earnings Expectations for the Week of October 24,"The earnings crunch is in full swing this this week. Quarterly results are due from the likes of Caterpillar (NYSE: CAT), Exxon Mobil (NYSE: XOM), Procter & Gamble (NYSE: PG) and United Parcel Service (NYSE: UPS), from which analysts expect to see year-over-year earnings growth, as well as Amazon.com (NASDAQ: AMZN), Boeing (NYSE: BA) and Ford (NYSE: F), which are forecast to post lower per-share earnings. Here is a day-by-day rundown of some of the most anticipated quarterly reports of this week. Monday Third-quarter reports from Caterpillar (NYSE: CAT) and Netflix (NYSE: NFLX) will be among Monday's highlights. Analysts predict the heavy equipment maker will report that per-share earnings rose 21.3% from a year ago to $1.55, while revenues increased 35.0% to $15.0 billion. Netflix is forecast to post per-share earnings of $0.95, up 16.7%, and revenues that are 46.7% higher a year ago, or $811.8 million. The day's other anticipated earnings gainers include Eaton (NYSE: ETN), Kimberly-Clark (NYSE: KMB) and Lorillard (NYSE: LO). Lower earnings are expected from Amgen (NASDAQ: AMGN) and Texas Instruments (NYSE: TXN). Tuesday Amazon.com (NASDAQ: AMZN) is on deck to report its third-quarter results Tuesday. The forecast calls for earnings of $0.24 per share and revenues of $10.9 billion. That compares to $0.51 per share and $7.5 billion in the same quarter of last year. The consensus EPS forecast has not changed in the past 60 days. Analysts expect United Parcel Service (NYSE: UPS), sometimes considered a bellwether of the wider economy, to report that per-share earnings rose 11.4% from a year ago to $1.05. Revenues are forecast to have increased 8.1% to $13.2 billion. UPS has topped consensus EPS estimates in the past eight quarters. U.S. Steel (NYSE: X) also reports on Tuesday and is expected to post its second consecutive profitable quarter. Earnings growth is also expected from Broadcom (NASDAQ: BRCM), Coach (NYSE: COH), DuPont (NYSE: DD), Reynolds American (NYSE: RAI), Sherwin-Williams (NYSE: SHW), T. Rowe Price (NASDAQ: TROW) and Xerox (NYSE: XRX). Per-share earnings are expected to have declined at DeVry (NYSE: DV), Molex (NASDAQ: MOLX) and Peabody Energy (NYSE: BTU). Wednesday Aerospace will be the focus on Wednesday, with Boeing (NYSE: BA), Lockheed Martin (NYSE: LMT) and Northrop Grumman (NYSE: NOC) due to release third-quarter results. While Boeing's per-share earnings are forecast to have slipped three cents from a year ago, those of the other two companies are expected to have increased by at least 10%. On the other hand, revenues are expected to have fallen 21.7% year-over-year in Northrop Grumman's case, but to have risen marginally for the other two. Note that all three companies have topped earnings expectations in the past few quarters. Ford (NYSE: F) is also scheduled to report its third-quarter results Wednesday. The forecast calls for earnings of $0.45 per share and revenues of $29.9 billion. That compares to EPS of $0.48 on $26.7 billion in sales in the year-ago quarter. Ford has fallen short of consensus EPS estimates in just one of the past eight quarters. Aflac (NYSE: AFL), Automatic Data Processing (NASDAQ: ADP), ConocoPhillips (NYSE: COP), Dr Pepper Snapple (NYSE: DPS), General Dynamics (NYSE: GD), Norfolk Southern (NYSE: NSC), O'Reilly Automotive (NASDAQ: ORLY), Visa (NYSE: V) and Wynn Resorts (NASDAQ: WYNN) are among those expected to report earnings growth. Lower earnings are predicted from American Electric Power (NYSE: AEP), Corning (NYSE: GLW), Novellus (NASDAQ: NVLS) and WellPoint (NYSE: WLP). And Spring Nextel (NYSE: S) is expected to post another net loss. Thursday Analysts anticipate that per-share earnings from Exxon Mobil (NYSE: XOM) will have surged 32.4% year-over-year to $2.13, but that EPS from Procter & Gamble (NYSE: PG) will be just a penny per share higher to $1.03. Revenues for the petrochemical giant are expected to be up 19.2% from a year ago, and that those of the Cincinnati-based consumer goods producer will be 7.1% higher. In the past 60 days, Exxon's EPS estimate has fallen three cents, but Procter & Gamble's is unchanged. Among the many companies expected to post higher earnings on Thursday are Aetna (NYSE: AET), Avon (NYSE: AVP), Cardinal Health (NYSE: CAH), Coca-Cola Enterprises (NYSE: CCE), Colgate-Palmolive (NYSE: CL), Dow Chemical (NYSE: DOW), Hershey (NYSE: HSY), MetLife (NYSE: MET), Starwood Hotels (NYSE: HOT), Time Warner Cable (NYSE: TWC) and Waste Management (NYSE: WM). Earnings are predicted to be lower for Bristol-Myers Squibb (NYSE: BMY), International Paper (NYSE: IP), Motorola Solutions (NYSE: MSI) and Raytheon (NYSE: RTN). And video game maker Electronic Arts (NASDAQ: ERTS) and home builder Pulte Group (NYSE: PHM) are expected to post net losses for the quarter. Friday Analysts expect solid to strong results from Chevron (NYSE: CVX), Merck (NYSE: MRK) and Whirlpool (NYSE: WHR) to end the week. Chevron's EPS are forecast to be 45.6% higher, Merck's to be up 6.6% and Whirlpool's to be 21.8% higher. Revenue growth is anticipated for all three as well, a jump of 39.9% for Chevron. Also look for Biogen Idec (NASDAQ: BIIB), Constellation Energy (NYSE: CEG), Goodyear (NYSE: GT) and Newmont Mining (NYSE: NEM) to reported earnings growth on Friday. Earnings from Cablevision (NYSE: CVC) and Dominion Resources (NYSE: D) are expected to be lower."
